image_path,text,exists,group
f:\OneDrive\TAI_LIEU_HK8\XLA\ocr_tieng_viet\data_daxuli\train\train_130\4.jpg,"Từ Sơn, Bắc Ninh (thứ ba, thứ năm) hay sới Yên Sở, Tây Hồ,",True,train_130
f:\OneDrive\TAI_LIEU_HK8\XLA\ocr_tieng_viet\data_daxuli\train\train_130\5.jpg,"Hà Nội (thứ bảy, chủ nhật). 1.001 thủ đoạn. Thông thường dân chơi",True,train_130
f:\OneDrive\TAI_LIEU_HK8\XLA\ocr_tieng_viet\data_daxuli\train\train_130\6.jpg,gà thường bắt cược những con gà mà họ nắm vững được lai lịch,True,train_130
f:\OneDrive\TAI_LIEU_HK8\XLA\ocr_tieng_viet\data_daxuli\train\train_130\7.jpg,"của nó : đã thua trận nào chưa, đã đá như thế nào...",True,train_130
f:\OneDrive\TAI_LIEU_HK8\XLA\ocr_tieng_viet\data_daxuli\train\train_130\8.jpg,"Nếu sơ ý bắt phải gà "" chột "" là đi tong. Đây là loại gà đã thua trận và",True,train_130
f:\OneDrive\TAI_LIEU_HK8\XLA\ocr_tieng_viet\data_daxuli\train\train_130\9.jpg,"không đá được nữa, nếu đá cũng chỉ vài hồ là bỏ chạy sớm. Phải xem phong",True,train_130
f:\OneDrive\TAI_LIEU_HK8\XLA\ocr_tieng_viet\data_daxuli\train\train_130\10.jpg,"độ, hôm ra trận phân nó phải đen, da nó phải đỏ, thần khí nó phải linh",True,train_130
f:\OneDrive\TAI_LIEU_HK8\XLA\ocr_tieng_viet\data_daxuli\train\train_130\11.jpg,hoạt... Vài năm trước dân đá gà chuyên nghiệp hẳn chưa quên con gà,True,train_130
f:\OneDrive\TAI_LIEU_HK8\XLA\ocr_tieng_viet\data_daxuli\train\train_130\12.jpg,"của Sự "" già "" người Thái Bình. Con ô rụt này có đặc điểm : khi lâm",True,train_130
f:\OneDrive\TAI_LIEU_HK8\XLA\ocr_tieng_viet\data_daxuli\train\train_130\13.jpg,"trận chỉ rụt cổ lại, lì đòn và đánh trả rất ít trong mấy hồ đầu.",True,train_130
f:\OneDrive\TAI_LIEU_HK8\XLA\ocr_tieng_viet\data_daxuli\train\train_130\14.jpg,"Điều này khiến đối phương lầm tưởng là nó sắp thua liền tăng tiền cọc theo "" cửa",True,train_130
f:\OneDrive\TAI_LIEU_HK8\XLA\ocr_tieng_viet\data_daxuli\train\train_130\15.jpg,"trên "". Lúc này con ô rụt mới tung ra những đòn khốc liệt. Loại gà này khi",True,train_130
f:\OneDrive\TAI_LIEU_HK8\XLA\ocr_tieng_viet\data_daxuli\train\train_130\16.jpg,"chưa đánh thì rất hiền lành, khi đánh rồi thì thật đáng sợ. Chính vì",True,train_130
f:\OneDrive\TAI_LIEU_HK8\XLA\ocr_tieng_viet\data_daxuli\train\train_130\17.jpg,thế mà con ô rụt đã từng một thời tung hoành khắp các sới gà miền Bắc,True,train_130
f:\OneDrive\TAI_LIEU_HK8\XLA\ocr_tieng_viet\data_daxuli\train\train_130\18.jpg,"và khiến bao tay chơi gà nhớ mãi "" bài học cay đắng "" ấy. Vì đồng tiền,",True,train_130
f:\OneDrive\TAI_LIEU_HK8\XLA\ocr_tieng_viet\data_daxuli\train\train_130\19.jpg,các con bạc không từ một thủ đoạn đê tiện nào.,True,train_130
f:\OneDrive\TAI_LIEU_HK8\XLA\ocr_tieng_viet\data_daxuli\train\train_130\20.jpg,"Có khi chúng lừa lúc chủ gà sơ ý liền đánh thuốc mê, cho gà ăn bả...,",True,train_130
f:\OneDrive\TAI_LIEU_HK8\XLA\ocr_tieng_viet\data_daxuli\train\train_130\21.jpg,"thậm chí còn dùng cả kim tẩm độc châm vào mình gà. Dính phải những "" độc",True,train_130
f:\OneDrive\TAI_LIEU_HK8\XLA\ocr_tieng_viet\data_daxuli\train\train_130\22.jpg,"chiêu "" này, nạn nhân gà chỉ còn cách nằm bẹp gí trên sới hoặc về "" chầu",True,train_130
f:\OneDrive\TAI_LIEU_HK8\XLA\ocr_tieng_viet\data_daxuli\train\train_130\23.jpg,"giời "" sớm. Chơi đá gà đã khiến không ít kẻ bị khuynh gia bại sản và cũng",True,train_130
f:\OneDrive\TAI_LIEU_HK8\XLA\ocr_tieng_viet\data_daxuli\train\train_130\24.jpg,có không ít người sống bám vào nó. Điều đáng ngạc nhiên là sự tồn tại của,True,train_130
f:\OneDrive\TAI_LIEU_HK8\XLA\ocr_tieng_viet\data_daxuli\train\train_130\25.jpg,"các sới gà cờ bạc thứ thiệt này ngày một lộ liễu, thậm chí có sới còn tồn tại",True,train_130
f:\OneDrive\TAI_LIEU_HK8\XLA\ocr_tieng_viet\data_daxuli\train\train_130\26.jpg,vài năm trời với qui mô ngày một lớn.,True,train_130
f:\OneDrive\TAI_LIEU_HK8\XLA\ocr_tieng_viet\data_daxuli\train\train_131\1.jpg,"1 - 12 - 2003, chỉ còn ít lâu là Tết Nguyên đán, công ty chuộc ra, đưa trở lại",True,train_131
f:\OneDrive\TAI_LIEU_HK8\XLA\ocr_tieng_viet\data_daxuli\train\train_131\2.jpg,"công trường, hứa giải quyết về trước tết, lại làm việc và sống cầm hơi như cũ.",True,train_131
f:\OneDrive\TAI_LIEU_HK8\XLA\ocr_tieng_viet\data_daxuli\train\train_131\3.jpg,"Ngày 2 - 1 - 2004, Hồ Văn Trương bị té lầu trong khi làm việc. Từ chiều đến 11",True,train_131
f:\OneDrive\TAI_LIEU_HK8\XLA\ocr_tieng_viet\data_daxuli\train\train_131\4.jpg,"giờ đêm mới có y tá đến đưa đi bệnh viện. 12 người trong tù ra, số còn lại",True,train_131
f:\OneDrive\TAI_LIEU_HK8\XLA\ocr_tieng_viet\data_daxuli\train\train_131\5.jpg,"thất nghiệp không có tiền ăn, phải tự cứu nhau. Chủ công trường không nhận lại vì",True,train_131
f:\OneDrive\TAI_LIEU_HK8\XLA\ocr_tieng_viet\data_daxuli\train\train_131\6.jpg,hết việc.,True,train_131
f:\OneDrive\TAI_LIEU_HK8\XLA\ocr_tieng_viet\data_daxuli\train\train_131\7.jpg,Công ty không ai dòm ngó. Hồ Văn Trương không có tiền thanh toán viện phí không,True,train_131
f:\OneDrive\TAI_LIEU_HK8\XLA\ocr_tieng_viet\data_daxuli\train\train_131\8.jpg,"biết sẽ ra sao. Có người may mắn được về hai ngày trước tết, số còn lại được",True,train_131
f:\OneDrive\TAI_LIEU_HK8\XLA\ocr_tieng_viet\data_daxuli\train\train_131\9.jpg,"đưa một ít tiền ăn và những lời hứa. Và ngày về Chiều 23 - 3 - 2004, trong",True,train_131
f:\OneDrive\TAI_LIEU_HK8\XLA\ocr_tieng_viet\data_daxuli\train\train_131\10.jpg,khi những lao động đang chờ đợi ngoài hành lang tại chi nhánh của công ty,True,train_131
f:\OneDrive\TAI_LIEU_HK8\XLA\ocr_tieng_viet\data_daxuli\train\train_131\11.jpg,"ở TP.HCM, chúng tôi làm việc trực tiếp với đại diện Công ty Bitocimex. Giám",True,train_131
f:\OneDrive\TAI_LIEU_HK8\XLA\ocr_tieng_viet\data_daxuli\train\train_131\12.jpg,"đốc là ông Nguyễn Thọ Tuấn vắng mặt đã lâu vì lý do sức khỏe, ông Lê",True,train_131
f:\OneDrive\TAI_LIEU_HK8\XLA\ocr_tieng_viet\data_daxuli\train\train_131\13.jpg,Tuấn Anh (phó giám đốc công ty) cùng người phụ trách mảng lao động trực,True,train_131
f:\OneDrive\TAI_LIEU_HK8\XLA\ocr_tieng_viet\data_daxuli\train\train_131\14.jpg,tiếp xử lý việc này.,True,train_131
f:\OneDrive\TAI_LIEU_HK8\XLA\ocr_tieng_viet\data_daxuli\train\train_131\15.jpg,"Ông Tuấn Anh nói : "" Lỗi không của riêng ai, đây là rủi ro trong làm ăn công",True,train_131
f:\OneDrive\TAI_LIEU_HK8\XLA\ocr_tieng_viet\data_daxuli\train\train_131\16.jpg,ty chỉ kiểm soát được một phần sự việc. Sự việc liên tục xảy ra khiến hai,True,train_131
f:\OneDrive\TAI_LIEU_HK8\XLA\ocr_tieng_viet\data_daxuli\train\train_131\17.jpg,"bên không có sự hợp tác, tin cậy..., mệt mỏi từ hai phía "". Không tiền bạc,",True,train_131
f:\OneDrive\TAI_LIEU_HK8\XLA\ocr_tieng_viet\data_daxuli\train\train_131\18.jpg,sức khỏe vơi đi cùng cả số tư trang ít ỏi trên người cũng được đánh đổi lấy đồ,True,train_131
f:\OneDrive\TAI_LIEU_HK8\XLA\ocr_tieng_viet\data_daxuli\train\train_131\19.jpg,dùng trong những ngày ở tù. Họ đếm từng ngày trôi đi trong gánh nặng,True,train_131
f:\OneDrive\TAI_LIEU_HK8\XLA\ocr_tieng_viet\data_daxuli\train\train_131\20.jpg,"tiền bạc. Riêng Hồ Văn Thông, số hộ chiếu AX 0134520, ở Cương Gián,",True,train_131
f:\OneDrive\TAI_LIEU_HK8\XLA\ocr_tieng_viet\data_daxuli\train\train_131\21.jpg,"Nghi Xuân, Hà Tĩnh, ngày 21 - 3 - 2004 đã về đến TP.HCM sau cuộc hành",True,train_131
f:\OneDrive\TAI_LIEU_HK8\XLA\ocr_tieng_viet\data_daxuli\train\train_131\22.jpg,"trình ba ngày từ Malaysia qua Thái Lan, Campuchia và đến cửa khẩu",True,train_131
f:\OneDrive\TAI_LIEU_HK8\XLA\ocr_tieng_viet\data_daxuli\train\train_131\23.jpg,An Giang.,True,train_131
f:\OneDrive\TAI_LIEU_HK8\XLA\ocr_tieng_viet\data_daxuli\train\train_131\24.jpg,""" Tôi không dám tin rằng mình còn sống bởi tất cả như là cơn ác mộng, hết đi",True,train_131
f:\OneDrive\TAI_LIEU_HK8\XLA\ocr_tieng_viet\data_daxuli\train\train_131\25.jpg,từ nỗi sợ hãi này đến kinh hoàng khác. Cứ lấy chân đạp trên nền đất để biết,True,train_131
f:\OneDrive\TAI_LIEU_HK8\XLA\ocr_tieng_viet\data_daxuli\train\train_131\26.jpg,"rất thật rằng đây là VN "". Vì không nằm trong danh sách những người được",True,train_131
f:\OneDrive\TAI_LIEU_HK8\XLA\ocr_tieng_viet\data_daxuli\train\train_131\27.jpg,"công ty đưa về, khủng hoảng và kiệt sức, tôi cố bám theo đoàn thương lái 30",True,train_131
f:\OneDrive\TAI_LIEU_HK8\XLA\ocr_tieng_viet\data_daxuli\train\train_131\28.jpg,"người, trà trộn và giả dạng người Campuchia, nhảy xe khách, đi bộ",True,train_131
f:\OneDrive\TAI_LIEU_HK8\XLA\ocr_tieng_viet\data_daxuli\train\train_131\29.jpg,"hàng chục kilômet, qua hàng rào cảnh sát các nước, may nhờ một người",True,train_131
f:\OneDrive\TAI_LIEU_HK8\XLA\ocr_tieng_viet\data_daxuli\train\train_131\30.jpg,VN che chở đã đóng tiền để qua được các vòng.,True,train_131
f:\OneDrive\TAI_LIEU_HK8\XLA\ocr_tieng_viet\data_daxuli\train\train_131\31.jpg,"Đôi mắt thâm quầng và nước da xanh mét, Thông nói : "" Dẫu sao chúng tôi",True,train_131
f:\OneDrive\TAI_LIEU_HK8\XLA\ocr_tieng_viet\data_daxuli\train\train_131\32.jpg,"cũng may mắn hơn những bạn bè khác hiện đang còn kẹt lại ở xứ người "".",True,train_131
f:\OneDrive\TAI_LIEU_HK8\XLA\ocr_tieng_viet\data_daxuli\train\train_132\1.jpg,Chương trình hành động thực hiện Nghị quyết trung ương 9 - khóa IX của Đảng bộ,True,train_132
f:\OneDrive\TAI_LIEU_HK8\XLA\ocr_tieng_viet\data_daxuli\train\train_132\2.jpg,"TP.HCM Về xây dựng Đảng : tiếp tục chỉ đạo mạnh mẽ, có hiệu quả cuộc vận động xây dựng",True,train_132
f:\OneDrive\TAI_LIEU_HK8\XLA\ocr_tieng_viet\data_daxuli\train\train_132\3.jpg,"chỉnh đốn Đảng theo tinh thần nghị quyết trung ương 6 (lần 2). Theo đó, tiếp tục thực",True,train_132
f:\OneDrive\TAI_LIEU_HK8\XLA\ocr_tieng_viet\data_daxuli\train\train_132\4.jpg,hiện việc kê khai nhà đất và cơ sở sản xuất kinh doanh của cán bộ - công,True,train_132
f:\OneDrive\TAI_LIEU_HK8\XLA\ocr_tieng_viet\data_daxuli\train\train_132\5.jpg,"chức; tăng cường thanh kiểm tra những nơi có dấu hiệu vi phạm, đặc biệt",True,train_132
f:\OneDrive\TAI_LIEU_HK8\XLA\ocr_tieng_viet\data_daxuli\train\train_132\6.jpg,trong lĩnh vực đất đai và các công trình trọng điểm.,True,train_132
f:\OneDrive\TAI_LIEU_HK8\XLA\ocr_tieng_viet\data_daxuli\train\train_132\7.jpg,Xử lý nghiêm minh theo pháp luật và kỷ luật của Đảng những người có,True,train_132
f:\OneDrive\TAI_LIEU_HK8\XLA\ocr_tieng_viet\data_daxuli\train\train_132\8.jpg,hành vi sai trái và những người bao che. Thực hiện tốt các quy định đối,True,train_132
f:\OneDrive\TAI_LIEU_HK8\XLA\ocr_tieng_viet\data_daxuli\train\train_132\9.jpg,"với cán bộ lãnh đạo, quản lý để xảy ra tham nhũng, tiêu cực ở cơ quan, đơn vị.",True,train_132
f:\OneDrive\TAI_LIEU_HK8\XLA\ocr_tieng_viet\data_daxuli\train\train_132\10.jpg,Kiện toàn và tăng cường sức chiến đấu của tổ chức cơ sở Đảng. Tiếp tục,True,train_132
f:\OneDrive\TAI_LIEU_HK8\XLA\ocr_tieng_viet\data_daxuli\train\train_132\11.jpg,đổi mới và nâng cao công tác cán bộ. Tiếp tục đổi mới phương thức lãnh,True,train_132
f:\OneDrive\TAI_LIEU_HK8\XLA\ocr_tieng_viet\data_daxuli\train\train_132\12.jpg,đạo của cấp ủy Đảng theo phương châm hướng mạnh về cơ sở.,True,train_132
f:\OneDrive\TAI_LIEU_HK8\XLA\ocr_tieng_viet\data_daxuli\train\train_132\13.jpg,"Về cải cách hành chính : Tập trung chấn chỉnh mạnh hơn nữa kỷ cương, kỷ",True,train_132
f:\OneDrive\TAI_LIEU_HK8\XLA\ocr_tieng_viet\data_daxuli\train\train_132\14.jpg,"luật trong bộ máy hành chính, nâng cao tinh thần trách nhiệm và ý thức",True,train_132
f:\OneDrive\TAI_LIEU_HK8\XLA\ocr_tieng_viet\data_daxuli\train\train_132\15.jpg,"kỷ luật của CB - CC, nhất là trên lĩnh vực nhà đất, đầu tư, kinh doanh",True,train_132
f:\OneDrive\TAI_LIEU_HK8\XLA\ocr_tieng_viet\data_daxuli\train\train_132\16.jpg,"trật tự xây dựng và giải quyết khiếu nại, tố cáo. Xây dựng hoàn thiện hệ thống",True,train_132
f:\OneDrive\TAI_LIEU_HK8\XLA\ocr_tieng_viet\data_daxuli\train\train_132\17.jpg,các qui trình thủ tục hành chính. Kiên quyết chấn chỉnh bộ máy hành chính,True,train_132
f:\OneDrive\TAI_LIEU_HK8\XLA\ocr_tieng_viet\data_daxuli\train\train_132\18.jpg,"các cấp, nhanh chóng khắc phục tình trạng quan liêu, cửa quyền, hách dịch.",True,train_132
f:\OneDrive\TAI_LIEU_HK8\XLA\ocr_tieng_viet\data_daxuli\train\train_132\19.jpg,"Xây dựng và phát triển đội ngũ CB - CC có chất lượng chuyên môn cao, có phẩm",True,train_132
f:\OneDrive\TAI_LIEU_HK8\XLA\ocr_tieng_viet\data_daxuli\train\train_132\20.jpg,"chất, đạo đức. Kiểm tra, xử lý kiên quyết các vụ tham nhũng, lãng phí, làm thất",True,train_132
f:\OneDrive\TAI_LIEU_HK8\XLA\ocr_tieng_viet\data_daxuli\train\train_132\21.jpg,thoát tài sản nhà nước... Về kinh tế : Tập trung mọi nỗ lực nhằm tháo gỡ,True,train_132
f:\OneDrive\TAI_LIEU_HK8\XLA\ocr_tieng_viet\data_daxuli\train\train_132\22.jpg,"sản xuất kinh doanh, đưa tốc độ tăng trưởng GDP trên địa bàn TP đạt 12%",True,train_132
f:\OneDrive\TAI_LIEU_HK8\XLA\ocr_tieng_viet\data_daxuli\train\train_132\23.jpg,"năm 2004 và trên 12% năm 2005. Phát triển nhanh các ngành dịch vụ,",True,train_132
f:\OneDrive\TAI_LIEU_HK8\XLA\ocr_tieng_viet\data_daxuli\train\train_132\24.jpg,tái cấu trúc các ngành công nghiệp.,True,train_132
f:\OneDrive\TAI_LIEU_HK8\XLA\ocr_tieng_viet\data_daxuli\train\train_132\25.jpg,Tiếp tục nhân rộng các mô hình huy động vốn đầu tư. Tập trung khai thác các,True,train_132
f:\OneDrive\TAI_LIEU_HK8\XLA\ocr_tieng_viet\data_daxuli\train\train_132\26.jpg,nguồn vốn cho ngân sách. Tổng kết quá trình cổ phần hóa doanh nghiệp,True,train_132
f:\OneDrive\TAI_LIEU_HK8\XLA\ocr_tieng_viet\data_daxuli\train\train_132\27.jpg,nhà nước và việc tổ chức sắp xếp lại doanh nghiệp nhà nước. Triển khai quyết,True,train_132
f:\OneDrive\TAI_LIEU_HK8\XLA\ocr_tieng_viet\data_daxuli\train\train_132\28.jpg,định của TP về một số chính sách ưu đãi đối với các dự án có vốn,True,train_132
f:\OneDrive\TAI_LIEU_HK8\XLA\ocr_tieng_viet\data_daxuli\train\train_132\29.jpg,đầu tư nước ngoài. Rà soát lại chương trình hội nhập kinh tế của TP.,True,train_132
f:\OneDrive\TAI_LIEU_HK8\XLA\ocr_tieng_viet\data_daxuli\train\train_132\30.jpg,"Về văn hóa - xã hội : đẩy mạnh xã hội hóa, phát triển xã hội học tập,",True,train_132
f:\OneDrive\TAI_LIEU_HK8\XLA\ocr_tieng_viet\data_daxuli\train\train_132\31.jpg,ưu tiên đầu tư ngân sách cho giáo dục - đào tạo.,True,train_132
f:\OneDrive\TAI_LIEU_HK8\XLA\ocr_tieng_viet\data_daxuli\train\train_132\32.jpg,Nâng cao năng lực quản lý nhà nước trên các lĩnh vực kinh doanh dịch,True,train_132
f:\OneDrive\TAI_LIEU_HK8\XLA\ocr_tieng_viet\data_daxuli\train\train_132\33.jpg,"vụ văn hóa; khắc phục những sơ hở, tiêu cực trong quản lý và hoạt động",True,train_132
f:\OneDrive\TAI_LIEU_HK8\XLA\ocr_tieng_viet\data_daxuli\train\train_132\34.jpg,văn hóa. Tiếp tục tập trung nguồn lực cho chương trình 3 giảm...,True,train_132
f:\OneDrive\TAI_LIEU_HK8\XLA\ocr_tieng_viet\data_daxuli\train\train_133\1.jpg,Số phận của những người nói lên sự thật. Ba năm sau cái ngày đấu tranh chống tiêu,True,train_133
f:\OneDrive\TAI_LIEU_HK8\XLA\ocr_tieng_viet\data_daxuli\train\train_133\2.jpg,"cực ở công trình đường liên cảng A5, gia đình anh Trương Xuân Đại rơi vào cảnh túng",True,train_133
f:\OneDrive\TAI_LIEU_HK8\XLA\ocr_tieng_viet\data_daxuli\train\train_133\3.jpg,"quẫn gần như cùng cực. Và trên hết, nghi vấn về "" một âm mưu tống tiền "" mà một",True,train_133
f:\OneDrive\TAI_LIEU_HK8\XLA\ocr_tieng_viet\data_daxuli\train\train_133\4.jpg,"bài báo gán cho anh, đã biến anh trở thành một người bị họ tộc, bạn bè,",True,train_133
f:\OneDrive\TAI_LIEU_HK8\XLA\ocr_tieng_viet\data_daxuli\train\train_133\5.jpg,người thân ngờ vực; bị mất công ăn việc làm. Lận đận vì bài báo.,True,train_133
f:\OneDrive\TAI_LIEU_HK8\XLA\ocr_tieng_viet\data_daxuli\train\train_133\6.jpg,"Cũng như số phận của vợ chồng anh Đại, những công nhân đứng ra tố",True,train_133
f:\OneDrive\TAI_LIEU_HK8\XLA\ocr_tieng_viet\data_daxuli\train\train_133\7.jpg,cáo tiêu cực ở đường liên cảng A5 ngày xưa bây giờ phiêu bạt khắp,True,train_133
f:\OneDrive\TAI_LIEU_HK8\XLA\ocr_tieng_viet\data_daxuli\train\train_133\8.jpg,nơi.,True,train_133
f:\OneDrive\TAI_LIEU_HK8\XLA\ocr_tieng_viet\data_daxuli\train\train_133\9.jpg,"Nhiều gia đình trong số họ đã dắt díu nhau đi đâu, chính anh Đại bây",True,train_133
f:\OneDrive\TAI_LIEU_HK8\XLA\ocr_tieng_viet\data_daxuli\train\train_133\10.jpg,giờ cũng không rõ. Chỉ còn vợ chồng anh cùng bốn người khác trong nhóm công,True,train_133
f:\OneDrive\TAI_LIEU_HK8\XLA\ocr_tieng_viet\data_daxuli\train\train_133\11.jpg,nhân 20 người đó còn bám trụ lại ở Sài Gòn. Ngồi với chúng tôi anh kể,True,train_133
f:\OneDrive\TAI_LIEU_HK8\XLA\ocr_tieng_viet\data_daxuli\train\train_133\12.jpg,"tên, kể hoàn cảnh của từng người : vợ chồng Trường - Trinh có hai con",True,train_133
f:\OneDrive\TAI_LIEU_HK8\XLA\ocr_tieng_viet\data_daxuli\train\train_133\13.jpg,nhỏ không biết bây giờ lang thang ở đâu; vợ chồng Mai Văn Lắm,True,train_133
f:\OneDrive\TAI_LIEU_HK8\XLA\ocr_tieng_viet\data_daxuli\train\train_133\14.jpg,lục đục với nhau vì Lắm thất nghiệp không tiền bạc nên bị vợ bỏ,True,train_133
f:\OneDrive\TAI_LIEU_HK8\XLA\ocr_tieng_viet\data_daxuli\train\train_133\15.jpg,dắt con về quê; Trương Xuân Đào dạt về tận Định Quán (Đồng Nai),True,train_133
f:\OneDrive\TAI_LIEU_HK8\XLA\ocr_tieng_viet\data_daxuli\train\train_133\16.jpg,"làm thuê, làm mướn; một vài người còn lại từ những công nhân xây",True,train_133
f:\OneDrive\TAI_LIEU_HK8\XLA\ocr_tieng_viet\data_daxuli\train\train_133\17.jpg,dựng trở thành người lượm ve chai...,True,train_133
f:\OneDrive\TAI_LIEU_HK8\XLA\ocr_tieng_viet\data_daxuli\train\train_133\18.jpg,"Thế nhưng, nỗi khổ vì thiếu thốn vật chất của anh cũng không thể sánh",True,train_133
f:\OneDrive\TAI_LIEU_HK8\XLA\ocr_tieng_viet\data_daxuli\train\train_133\19.jpg,"bằng nỗi đau mất danh dự, tinh thần khi xuất hiện bài báo "" Một âm",True,train_133
f:\OneDrive\TAI_LIEU_HK8\XLA\ocr_tieng_viet\data_daxuli\train\train_133\20.jpg,"mưu tống tiền? "" đăng trên báo Pháp Luật TP.HCM. Khi hay tin có",True,train_133
f:\OneDrive\TAI_LIEU_HK8\XLA\ocr_tieng_viet\data_daxuli\train\train_133\21.jpg,"bài báo viết về "" âm mưu tống tiền "" của anh, người cha già đã 80 tuổi",True,train_133
f:\OneDrive\TAI_LIEU_HK8\XLA\ocr_tieng_viet\data_daxuli\train\train_133\22.jpg,"ở tận thôn Đông, xã Đào Viên, huyện Quế Võ (Bắc Ninh) nhắn tin",True,train_133
f:\OneDrive\TAI_LIEU_HK8\XLA\ocr_tieng_viet\data_daxuli\train\train_133\23.jpg,"rằng : "" Sao các con đi làm chuyện thất đức vậy, cha là một thương",True,train_133
f:\OneDrive\TAI_LIEU_HK8\XLA\ocr_tieng_viet\data_daxuli\train\train_133\24.jpg,"binh đã xả thân vì nước, không muốn danh dự gia đình mình bị",True,train_133
f:\OneDrive\TAI_LIEU_HK8\XLA\ocr_tieng_viet\data_daxuli\train\train_133\25.jpg,"vùi lấp bằng vết nhơ này "".",True,train_133
f:\OneDrive\TAI_LIEU_HK8\XLA\ocr_tieng_viet\data_daxuli\train\train_133\26.jpg,"Ông quả quyết rằng nếu đây là sự thật thì ông sẽ ra làng, xã làm",True,train_133
f:\OneDrive\TAI_LIEU_HK8\XLA\ocr_tieng_viet\data_daxuli\train\train_133\27.jpg,đơn từ con và coi như anh Đại không có trên cuộc đời này. Chỉ tay,True,train_133
f:\OneDrive\TAI_LIEU_HK8\XLA\ocr_tieng_viet\data_daxuli\train\train_133\28.jpg,"vào đứa con gái của mình, anh Đại nói : "" Vợ chồng tôi khổ ít,",True,train_133
f:\OneDrive\TAI_LIEU_HK8\XLA\ocr_tieng_viet\data_daxuli\train\train_133\29.jpg,con gái tôi mới khổ nhiều. Nỗi oan chưa được giải nên cháu,True,train_133
f:\OneDrive\TAI_LIEU_HK8\XLA\ocr_tieng_viet\data_daxuli\train\train_133\30.jpg,"cũng phải sống trong sự ngờ vực của bạn bè "". Và cũng chính",True,train_133
f:\OneDrive\TAI_LIEU_HK8\XLA\ocr_tieng_viet\data_daxuli\train\train_133\31.jpg,"vì nỗi đau này, anh đã quyết định đi kiện báo Pháp Luật",True,train_133
f:\OneDrive\TAI_LIEU_HK8\XLA\ocr_tieng_viet\data_daxuli\train\train_133\32.jpg,TP.HCM để đòi lại danh dự cho mình.,True,train_133
f:\OneDrive\TAI_LIEU_HK8\XLA\ocr_tieng_viet\data_daxuli\train\train_133\33.jpg,"Anh khẳng định : "" Trong vụ kiện này, tiền bạc đối với tôi",True,train_133
f:\OneDrive\TAI_LIEU_HK8\XLA\ocr_tieng_viet\data_daxuli\train\train_133\34.jpg,"không phải là tất cả, dù gia đình tôi đang rất túng quẫn "".",True,train_133
f:\OneDrive\TAI_LIEU_HK8\XLA\ocr_tieng_viet\data_daxuli\train\train_134\1.jpg,"Cầu Bình Triệu 2 chưa xây xong, làm đường tạm cho các phương tiện giao thông đi lại Điều đáng nói là sau đường",True,train_134
f:\OneDrive\TAI_LIEU_HK8\XLA\ocr_tieng_viet\data_daxuli\train\train_134\2.jpg,tạm đến... trạm thu phí tạm... Từ đường tạm Mãi đến tháng 9 - 2003 cầu Bình Triệu 2 mới được thông xe,True,train_134
f:\OneDrive\TAI_LIEU_HK8\XLA\ocr_tieng_viet\data_daxuli\train\train_134\3.jpg,"bằng đường tạm (cũng vì phải né sáu hộ dân chưa di dời. Như vậy, trước thời điểm cấm xe tải nặng lưu",True,train_134
f:\OneDrive\TAI_LIEU_HK8\XLA\ocr_tieng_viet\data_daxuli\train\train_134\4.jpg,"thông ở nội ô vào ban ngày (1 - 9 - 2003), cầu Bình Triệu 2 được "" ép "" đưa vào khai thác trong tình trạng",True,train_134
f:\OneDrive\TAI_LIEU_HK8\XLA\ocr_tieng_viet\data_daxuli\train\train_134\5.jpg,dòng xe phải đi vòng một đoạn phía Thủ Đức.,True,train_134
f:\OneDrive\TAI_LIEU_HK8\XLA\ocr_tieng_viet\data_daxuli\train\train_134\6.jpg,Giải pháp tạm thời này nhằm gỡ thế bí câu thúc về tiến độ cho nhà đầu tư Tổng công ty Xây dựng công,True,train_134
f:\OneDrive\TAI_LIEU_HK8\XLA\ocr_tieng_viet\data_daxuli\train\train_134\7.jpg,trình giao thông 5 (Cienco 5) và quan trọng hơn là nhằm giải quyết cho luồng xe tải nặng được lưu,True,train_134
f:\OneDrive\TAI_LIEU_HK8\XLA\ocr_tieng_viet\data_daxuli\train\train_134\8.jpg,"thông ban ngày theo hướng bắt buộc (từ đường Nguyễn Hữu Cả) Ông Phạm Xuân Ái, trưởng ban",True,train_134
f:\OneDrive\TAI_LIEU_HK8\XLA\ocr_tieng_viet\data_daxuli\train\train_134\9.jpg,Kinh tế - ngân sách HĐND TP.HCM : Băn khoăn của người dân là đúng! Công trình cầu đường,True,train_134
f:\OneDrive\TAI_LIEU_HK8\XLA\ocr_tieng_viet\data_daxuli\train\train_134\10.jpg,Bình Triệu 2 (BT2) do có thay đổi thiết kế ban đầu nên làm cho tiến độ kéo dài.,True,train_134
f:\OneDrive\TAI_LIEU_HK8\XLA\ocr_tieng_viet\data_daxuli\train\train_134\11.jpg,Đó là nguyên nhân khách quan. Còn về chủ quan thì do ngay từ ban đầu ta chưa có tầm nhìn,True,train_134
f:\OneDrive\TAI_LIEU_HK8\XLA\ocr_tieng_viet\data_daxuli\train\train_134\12.jpg,"xa về vấn đề qui hoạch giao thông. Trước ta định làm nhỏ, vừa để giải quyết vấn đề ách",True,train_134
f:\OneDrive\TAI_LIEU_HK8\XLA\ocr_tieng_viet\data_daxuli\train\train_134\13.jpg,tắc giao thông ở cửa ngõ thành phố. Nhưng sau đó mới thấy đây là con đường nối liền,True,train_134
f:\OneDrive\TAI_LIEU_HK8\XLA\ocr_tieng_viet\data_daxuli\train\train_134\14.jpg,"với Bình Dương đang phát triển, là đường nối với đường Hồ Chí Minh đoạn từ Chơn Thành",True,train_134
f:\OneDrive\TAI_LIEU_HK8\XLA\ocr_tieng_viet\data_daxuli\train\train_134\15.jpg,"đổ về. Việc thay đổi thiết kế là cần thiết, phù hợp với tương lai.",True,train_134
