image_path,text,exists,group
f:\OneDrive\TAI_LIEU_HK8\XLA\ocr_tieng_viet\data_daxuli\train\train_047\22.jpg,""" Bọn tôi dồn sức chuyển xác ra, giờ trong bãi chẳng còn ai. Phải hơn 10 người",True,train_047
f:\OneDrive\TAI_LIEU_HK8\XLA\ocr_tieng_viet\data_daxuli\train\train_047\23.jpg,mới chuyển được một xác. 40 km từ bãi Phước Thành ra đây phải đi suốt,True,train_047
f:\OneDrive\TAI_LIEU_HK8\XLA\ocr_tieng_viet\data_daxuli\train\train_047\24.jpg,"một ngày đêm, mãi đến sáng 15 - 11 mới ra đây được... "", Ngô Văn Hoàng -",True,train_047
f:\OneDrive\TAI_LIEU_HK8\XLA\ocr_tieng_viet\data_daxuli\train\train_047\25.jpg,"một công nhân 19 tuổi - nói. Đêm kinh hoàng. Ở văn phòng Công ty Trường Sơn,",True,train_047
f:\OneDrive\TAI_LIEU_HK8\XLA\ocr_tieng_viet\data_daxuli\train\train_047\26.jpg,"cách bãi xác chừng 150 m, cũng trong những bộ đồ xanh sẫm rộng",True,train_047
f:\OneDrive\TAI_LIEU_HK8\XLA\ocr_tieng_viet\data_daxuli\train\train_047\27.jpg,"thùng thình, gần 50 công nhân, người đứng nhìn những bạn bè mình ở",True,train_047
f:\OneDrive\TAI_LIEU_HK8\XLA\ocr_tieng_viet\data_daxuli\train\train_047\28.jpg,""" nhà vĩnh biệt "", người lê la trước cửa văn phòng, tất cả đều lặng",True,train_047
f:\OneDrive\TAI_LIEU_HK8\XLA\ocr_tieng_viet\data_daxuli\train\train_047\29.jpg,"im, buồn bã.",True,train_047
f:\OneDrive\TAI_LIEU_HK8\XLA\ocr_tieng_viet\data_daxuli\train\train_047\30.jpg,"Giám đốc Lại Văn Quyền mắt đỏ, mặt phờ phạc vì thiếu ngủ và lo lắng",True,train_047
f:\OneDrive\TAI_LIEU_HK8\XLA\ocr_tieng_viet\data_daxuli\train\train_047\31.jpg,"nói vắn tắt về thảm trạng : "" Thấy trời mưa lớn, trưa 13 - 11 chúng tôi cho",True,train_047
f:\OneDrive\TAI_LIEU_HK8\XLA\ocr_tieng_viet\data_daxuli\train\train_047\32.jpg,anh em đang ngủ thì thảm nạn xảy ra. Dòng lũ từ trên núi ào,True,train_047
f:\OneDrive\TAI_LIEU_HK8\XLA\ocr_tieng_viet\data_daxuli\train\train_047\33.jpg,"xuống cuốn đất đá theo, đẩy cả trại số 4 đi, vùi lấp anh em.",True,train_047
f:\OneDrive\TAI_LIEU_HK8\XLA\ocr_tieng_viet\data_daxuli\train\train_048\1.jpg,Công trình mẫu... thi công bê bối. Công trình đường Trương Định nối dài (TP.HCM) vừa xây dựng,True,train_048
f:\OneDrive\TAI_LIEU_HK8\XLA\ocr_tieng_viet\data_daxuli\train\train_048\2.jpg,khoảng hơn hai tuần nay do Công ty chi nhánh Bạch Đằng thi công đã gây ra rất nhiều phiền,True,train_048
f:\OneDrive\TAI_LIEU_HK8\XLA\ocr_tieng_viet\data_daxuli\train\train_048\3.jpg,phức cho người dân khu vực. Mặc dù đây là công trình được Khu Quản lý giao thông đô thị,True,train_048
f:\OneDrive\TAI_LIEU_HK8\XLA\ocr_tieng_viet\data_daxuli\train\train_048\4.jpg,"(chủ đầu tư) đăng ký công trình mẫu, nhưng thay vì thi công theo từng đoạn cuốn chiếu thì đơn vị lại đào",True,train_048
f:\OneDrive\TAI_LIEU_HK8\XLA\ocr_tieng_viet\data_daxuli\train\train_048\5.jpg,rãnh sâu khoảng hơn 2 m chạy dọc theo tuyến đường làm cản trở hoạt động giao thông.,True,train_048
f:\OneDrive\TAI_LIEU_HK8\XLA\ocr_tieng_viet\data_daxuli\train\train_048\6.jpg,"Trên tuyến đường Kỳ Đồng cát rơi vãi khắp nơi, dây điện thoại đứt, dãy rào chắn tạm bợ cách ly",True,train_048
f:\OneDrive\TAI_LIEU_HK8\XLA\ocr_tieng_viet\data_daxuli\train\train_048\7.jpg,"công trình và đường lưu thông bị sập vẫn không được sửa chữa. Trong khi đó, nhiều ống cống bêtông",True,train_048
f:\OneDrive\TAI_LIEU_HK8\XLA\ocr_tieng_viet\data_daxuli\train\train_048\8.jpg,"đã trơ sắt ra ngoài cũng được lắp đặt sử dụng. Ngoài ra, đáng lẽ đổ cát lấp đường ống theo tiêu",True,train_048
f:\OneDrive\TAI_LIEU_HK8\XLA\ocr_tieng_viet\data_daxuli\train\train_048\9.jpg,chuẩn về xây dựng hệ thống thoát nước thì đơn vị thi công lấp đất. Liệu công trình này có đáng là,True,train_048
f:\OneDrive\TAI_LIEU_HK8\XLA\ocr_tieng_viet\data_daxuli\train\train_048\10.jpg,công trình mẫu?,True,train_048
f:\OneDrive\TAI_LIEU_HK8\XLA\ocr_tieng_viet\data_daxuli\train\train_049\1.jpg,"Lã Thị Kim Oanh : NH khẳng định "" Cho vay vì có bảo lãnh "". Hội đồng xét xử phúc thẩm Lã Thị Kim Oanh",True,train_049
f:\OneDrive\TAI_LIEU_HK8\XLA\ocr_tieng_viet\data_daxuli\train\train_049\2.jpg,"bắt đầu thẩm vấn các ngân hàng đối với những khoản vay của Cty Tiếp thị với số tiền 85,354 tỉ",True,train_049
f:\OneDrive\TAI_LIEU_HK8\XLA\ocr_tieng_viet\data_daxuli\train\train_049\3.jpg,đồng. Đại diện NH Công thương Ba Đình cho biết ngoài công văn của Chính phủ khẳng định sẽ có kế,True,train_049
f:\OneDrive\TAI_LIEU_HK8\XLA\ocr_tieng_viet\data_daxuli\train\train_049\4.jpg,"hoạch bố trí vốn cho dự án khu triển lãm nông nghiệp, công văn bảo lãnh do lãnh đạo Bộ NN",True,train_049
f:\OneDrive\TAI_LIEU_HK8\XLA\ocr_tieng_viet\data_daxuli\train\train_049\5.jpg,"& PTNT ký chính là điều kiện tiên quyết để NH xem xét cho vay theo kiểu "" vay đệm "" trong",True,train_049
f:\OneDrive\TAI_LIEU_HK8\XLA\ocr_tieng_viet\data_daxuli\train\train_049\6.jpg,khi chờ ngân sách cấp :,True,train_049
f:\OneDrive\TAI_LIEU_HK8\XLA\ocr_tieng_viet\data_daxuli\train\train_049\7.jpg,""" Nếu không có xác nhận của bộ chủ quản đối với dự án, NH sẽ không cho vay vì không nắm rõ",True,train_049
f:\OneDrive\TAI_LIEU_HK8\XLA\ocr_tieng_viet\data_daxuli\train\train_049\8.jpg,"được nhu cầu vốn của Công ty Tiếp thị "". Cũng với lý do tương tự, đại diện của NH Đầu tư phát",True,train_049
f:\OneDrive\TAI_LIEU_HK8\XLA\ocr_tieng_viet\data_daxuli\train\train_049\9.jpg,"triển cũng sẽ dứt khoát không cho vay. "" Nhẹ nhàng "" hơn, đại diện của NH Thương mại cổ",True,train_049
f:\OneDrive\TAI_LIEU_HK8\XLA\ocr_tieng_viet\data_daxuli\train\train_049\10.jpg,phần Hàng hải cho biết thông thường các công văn như vậy là cần thiết nhưng không phải,True,train_049
f:\OneDrive\TAI_LIEU_HK8\XLA\ocr_tieng_viet\data_daxuli\train\train_049\11.jpg,là quyết định đối với các khoản vay NH.,True,train_049
f:\OneDrive\TAI_LIEU_HK8\XLA\ocr_tieng_viet\data_daxuli\train\train_049\12.jpg,Ba phần tư thời gian còn lại của ngày làm việc được HĐXX tập trung thẩm vấn Lã Thị Kim,True,train_049
f:\OneDrive\TAI_LIEU_HK8\XLA\ocr_tieng_viet\data_daxuli\train\train_049\13.jpg,Oanh về chi tiết việc sử dụng những khoản vay NH cũng như những khoản vay của các công ty,True,train_049
f:\OneDrive\TAI_LIEU_HK8\XLA\ocr_tieng_viet\data_daxuli\train\train_049\14.jpg,cá nhân khác. Bị cáo Lã Thị Kim Oanh khẳng định những khoản vay của NH đều đi,True,train_049
f:\OneDrive\TAI_LIEU_HK8\XLA\ocr_tieng_viet\data_daxuli\train\train_049\15.jpg,"kèm với những dự án đầu tư hoặc kinh doanh cụ thể. Tuy nhiên, khi HĐXX hỏi kỹ về",True,train_049
f:\OneDrive\TAI_LIEU_HK8\XLA\ocr_tieng_viet\data_daxuli\train\train_049\16.jpg,"cách sử dụng khoản vay từ NH NN & PTNT Hà Nội (8,3 tỉ đồng), Lã Thị Kim Oanh",True,train_049
f:\OneDrive\TAI_LIEU_HK8\XLA\ocr_tieng_viet\data_daxuli\train\train_049\17.jpg,thừa nhận mục đích vay là để kinh doanh đồ gỗ nhưng cuối cùng lại dùng để trả nợ,True,train_049
f:\OneDrive\TAI_LIEU_HK8\XLA\ocr_tieng_viet\data_daxuli\train\train_049\18.jpg,cho NH NN & PTNT trung ương.,True,train_049
f:\OneDrive\TAI_LIEU_HK8\XLA\ocr_tieng_viet\data_daxuli\train\train_049\19.jpg,"Trong suốt quá trình trả lời thẩm vấn về các nội dung chi tiền, điệp khúc "" đây là những",True,train_049
f:\OneDrive\TAI_LIEU_HK8\XLA\ocr_tieng_viet\data_daxuli\train\train_049\20.jpg,"khoản chi cần thiết trong quá trình thực hiện dự án "" được Lã Thị Kim Oanh lặp đi",True,train_049
f:\OneDrive\TAI_LIEU_HK8\XLA\ocr_tieng_viet\data_daxuli\train\train_049\21.jpg,"lặp lại. Những khoản chi cần thiết, theo Lã Thị Kim Oanh, là chi cho hội họp,",True,train_049
f:\OneDrive\TAI_LIEU_HK8\XLA\ocr_tieng_viet\data_daxuli\train\train_049\22.jpg,"giao dịch, mời các sở, ban ngành xuống thực địa các dự án, thậm chí... đi lễ",True,train_049
f:\OneDrive\TAI_LIEU_HK8\XLA\ocr_tieng_viet\data_daxuli\train\train_049\23.jpg,"chùa. "" Công trình Trung tâm tiếp thị 79 Hàng Bồ có gì đâu mà phải mời tất cả",True,train_049
f:\OneDrive\TAI_LIEU_HK8\XLA\ocr_tieng_viet\data_daxuli\train\train_049\24.jpg,"các ban ngành xuống? "" "" - tòa hỏi.",True,train_049
f:\OneDrive\TAI_LIEU_HK8\XLA\ocr_tieng_viet\data_daxuli\train\train_049\25.jpg,"Lã Thị Kim Oanh : "" Thủ tục để triển khai công trình rất phức tạp, HĐXX nói vậy",True,train_049
f:\OneDrive\TAI_LIEU_HK8\XLA\ocr_tieng_viet\data_daxuli\train\train_049\26.jpg,"thì bị cáo không biết phải trả lời như thế nào "". Ngoài những khoản chi liên quan đến",True,train_049
f:\OneDrive\TAI_LIEU_HK8\XLA\ocr_tieng_viet\data_daxuli\train\train_049\27.jpg,"NH, các khoản chi khác Lã Thị Kim Oanh không giải trình được cụ thể. Tuy nhiên,",True,train_049
f:\OneDrive\TAI_LIEU_HK8\XLA\ocr_tieng_viet\data_daxuli\train\train_049\28.jpg,chủ tọa phiên tòa - thẩm phán Nguyễn Hùng Cường - cho biết HĐXX sẽ xem,True,train_049
f:\OneDrive\TAI_LIEU_HK8\XLA\ocr_tieng_viet\data_daxuli\train\train_049\29.jpg,xét nội dung giải trình đối với một số khoản chi mà Lã Thị Kim Oanh cho rằng tòa,True,train_049
f:\OneDrive\TAI_LIEU_HK8\XLA\ocr_tieng_viet\data_daxuli\train\train_049\30.jpg,sơ thẩm chưa xem xét thỏa đáng.,True,train_049
f:\OneDrive\TAI_LIEU_HK8\XLA\ocr_tieng_viet\data_daxuli\train\train_049\31.jpg,"Theo dự kiến, hôm nay 24 - 3, HĐXX sẽ chuyển sang thẩm vấn nội dung cố ý",True,train_049
f:\OneDrive\TAI_LIEU_HK8\XLA\ocr_tieng_viet\data_daxuli\train\train_049\32.jpg,"làm trái gây hậu quả nghiêm trọng của các bị cáo. Trao đổi với báo chí chiều qua,",True,train_049
f:\OneDrive\TAI_LIEU_HK8\XLA\ocr_tieng_viet\data_daxuli\train\train_049\33.jpg,phó chánh tòa hình sự Nguyễn Quốc Tú cho biết việc tiến hành đối chất,True,train_049
f:\OneDrive\TAI_LIEU_HK8\XLA\ocr_tieng_viet\data_daxuli\train\train_049\34.jpg,giữa bị cáo Nguyễn Quang Hà và Nguyễn Thiện Luân với nguyên bộ trưởng,True,train_049
f:\OneDrive\TAI_LIEU_HK8\XLA\ocr_tieng_viet\data_daxuli\train\train_049\35.jpg,Bộ NN & PTNT Nguyễn Công Tạn và Bộ trưởng Bộ NN & PTNT,True,train_049
f:\OneDrive\TAI_LIEU_HK8\XLA\ocr_tieng_viet\data_daxuli\train\train_049\36.jpg,Lê Huy Ngọ sẽ được HĐXX căn cứ vào tình hình thực tế quyết định.,True,train_049
f:\OneDrive\TAI_LIEU_HK8\XLA\ocr_tieng_viet\data_daxuli\train\train_050\1.jpg,Tây nguyên và Nam bộ : Có khả năng thiếu nước trên diện rộng. Cục Thủy lợi (Bộ Nông,True,train_050
f:\OneDrive\TAI_LIEU_HK8\XLA\ocr_tieng_viet\data_daxuli\train\train_050\2.jpg,nghiệp & phát triển nông thôn) dự báo khu vực Tây Nguyên và Nam bộ có khả năng,True,train_050
f:\OneDrive\TAI_LIEU_HK8\XLA\ocr_tieng_viet\data_daxuli\train\train_050\3.jpg,sẽ thiếu nước ngọt và bị nước mặn xâm nhập trên diện rộng vì từ nay đến tháng,True,train_050
f:\OneDrive\TAI_LIEU_HK8\XLA\ocr_tieng_viet\data_daxuli\train\train_050\4.jpg,5 - 2004 tổng lượng mưa tại các tỉnh trong khu vực sẽ thiếu hụt so với trung bình,True,train_050
f:\OneDrive\TAI_LIEU_HK8\XLA\ocr_tieng_viet\data_daxuli\train\train_050\5.jpg,nhiều năm cùng thời kỳ. Dự báo nếu tiếp tục không mưa và nước mặn xâm nhập,True,train_050
f:\OneDrive\TAI_LIEU_HK8\XLA\ocr_tieng_viet\data_daxuli\train\train_050\6.jpg,sâu sẽ khiến hơn 44.000 ha đất nông nghiệp gặp khó khăn về nguồn nước,True,train_050
f:\OneDrive\TAI_LIEU_HK8\XLA\ocr_tieng_viet\data_daxuli\train\train_050\7.jpg,tưới vào cuối vụ đông xuân.,True,train_050
f:\OneDrive\TAI_LIEU_HK8\XLA\ocr_tieng_viet\data_daxuli\train\train_050\8.jpg,"Trong khi đó, tại lễ kỷ niệm Ngày nước thế giới (22 - 3), bà Kanni ignaraja,",True,train_050
f:\OneDrive\TAI_LIEU_HK8\XLA\ocr_tieng_viet\data_daxuli\train\train_050\9.jpg,phó đại diện thường trú của Chương trình Phát triển Liên Hiệp Quốc (UNDP),True,train_050
f:\OneDrive\TAI_LIEU_HK8\XLA\ocr_tieng_viet\data_daxuli\train\train_050\10.jpg,"tại Hà Nội, khẳng định nếu VN muốn giải quyết được mục tiêu cung cấp nước sạch cho",True,train_050
f:\OneDrive\TAI_LIEU_HK8\XLA\ocr_tieng_viet\data_daxuli\train\train_050\11.jpg,85% dân số vào năm 2010 và cho 100% dân số vào năm 2020 thì phải có ba,True,train_050
f:\OneDrive\TAI_LIEU_HK8\XLA\ocr_tieng_viet\data_daxuli\train\train_050\12.jpg,"yếu tố : tạo ra nhiều hơn nữa các nguồn đầu tư trong và ngoài nước, xác định ưu",True,train_050
f:\OneDrive\TAI_LIEU_HK8\XLA\ocr_tieng_viet\data_daxuli\train\train_050\13.jpg,"tiên về xây dựng năng lực ở những nơi có nhu cầu nước lớn nhất, huy động",True,train_050
f:\OneDrive\TAI_LIEU_HK8\XLA\ocr_tieng_viet\data_daxuli\train\train_050\14.jpg,nhiều đối tượng tham gia thực hiện phương thức quản lý tài nguyên nước.,True,train_050
f:\OneDrive\TAI_LIEU_HK8\XLA\ocr_tieng_viet\data_daxuli\train\train_051\1.jpg,206 ngày đêm khốn khổ 87 trang nhật ký Trên giấy A4 là tâm sự của,True,train_051
f:\OneDrive\TAI_LIEU_HK8\XLA\ocr_tieng_viet\data_daxuli\train\train_051\2.jpg,"17 con người sau 206 ngày gian nan nơi xứ lạ : không việc làm, không nhà ở, không",True,train_051
f:\OneDrive\TAI_LIEU_HK8\XLA\ocr_tieng_viet\data_daxuli\train\train_051\3.jpg,"lương bổng, có người bị đói khát, bị tù tội... Chúng tôi nhận được "" tác phẩm "" "" Nhật ký -",True,train_051
f:\OneDrive\TAI_LIEU_HK8\XLA\ocr_tieng_viet\data_daxuli\train\train_051\4.jpg,"cuộc hành trình gian khổ Malaysia "" với chữ ký cùng địa chỉ, số hộ chiếu của 17 / 61",True,train_051
f:\OneDrive\TAI_LIEU_HK8\XLA\ocr_tieng_viet\data_daxuli\train\train_051\5.jpg,lao động được Công ty Bitocimex (Công ty Thương mại xuất nhập khẩu du lịch Bình,True,train_051
f:\OneDrive\TAI_LIEU_HK8\XLA\ocr_tieng_viet\data_daxuli\train\train_051\6.jpg,Phước - trực thuộc UBND tỉnh Bình Phước) đưa đi Malaysia ngày 21 - 8 - 2003,True,train_051
f:\OneDrive\TAI_LIEU_HK8\XLA\ocr_tieng_viet\data_daxuli\train\train_051\7.jpg,và về nước từ ngày 17 - 3 - 2004.,True,train_051
f:\OneDrive\TAI_LIEU_HK8\XLA\ocr_tieng_viet\data_daxuli\train\train_051\8.jpg,87 trang nhật ký trên giấy A4 là tâm sự của 17 con người sau 206 ngày gian nan nơi xứ lạ :,True,train_051
f:\OneDrive\TAI_LIEU_HK8\XLA\ocr_tieng_viet\data_daxuli\train\train_051\9.jpg,"không việc làm, không nhà ở, không lương bổng, có người bị đói khát, bị tù tội... Giờ",True,train_051
f:\OneDrive\TAI_LIEU_HK8\XLA\ocr_tieng_viet\data_daxuli\train\train_051\10.jpg,"đây, những con người ấy dường như không dám nhìn thẳng mặt nhau bởi nỗi đau",True,train_051
f:\OneDrive\TAI_LIEU_HK8\XLA\ocr_tieng_viet\data_daxuli\train\train_051\11.jpg,của những ngày cũ cứ ào tới... Nước mắt và sự thảng thốt vẫn còn hiện rõ trên,True,train_051
f:\OneDrive\TAI_LIEU_HK8\XLA\ocr_tieng_viet\data_daxuli\train\train_051\12.jpg,từng khuôn mặt. Johor ngày thứ nhất. Họ đưa chúng tôi đến khu vực công trường,True,train_051
f:\OneDrive\TAI_LIEU_HK8\XLA\ocr_tieng_viet\data_daxuli\train\train_051\13.jpg,"bên cạnh khu rừng, nơi không có bóng dáng người dân, chỉ có ít người Indo đang",True,train_051
f:\OneDrive\TAI_LIEU_HK8\XLA\ocr_tieng_viet\data_daxuli\train\train_051\14.jpg,làm việc tại đó.,True,train_051
f:\OneDrive\TAI_LIEU_HK8\XLA\ocr_tieng_viet\data_daxuli\train\train_051\15.jpg,"Đây gọi là Johor, 61 người chúng tôi được đổ xuống một căngtin chật hẹp, không có",True,train_051
f:\OneDrive\TAI_LIEU_HK8\XLA\ocr_tieng_viet\data_daxuli\train\train_051\16.jpg,"ông chủ, cũng không ai cho chúng tôi biết phải làm gì, ăn ở thế nào. Cả đoàn mang",True,train_051
f:\OneDrive\TAI_LIEU_HK8\XLA\ocr_tieng_viet\data_daxuli\train\train_051\17.jpg,"mì gói ra ăn, lượm các lon bia để nấu nước sôi. Sau ba ngày ăn ngủ tự túc, mỗi",True,train_051
f:\OneDrive\TAI_LIEU_HK8\XLA\ocr_tieng_viet\data_daxuli\train\train_051\18.jpg,"người được phát hai phần cơm / ngày, cả suất trưa và chiều dồn một. Cuộc sống kéo",True,train_051
f:\OneDrive\TAI_LIEU_HK8\XLA\ocr_tieng_viet\data_daxuli\train\train_051\19.jpg,"dài như thế. Chúng tôi thay phiên nhau "" bán "" cả thân mình cũng không đủ tiền",True,train_051
f:\OneDrive\TAI_LIEU_HK8\XLA\ocr_tieng_viet\data_daxuli\train\train_051\20.jpg,"ăn, mỗi ngày chỉ 10 - 15 người đi làm, công việc dọn vệ sinh công trình, làm côppha.",True,train_051
f:\OneDrive\TAI_LIEU_HK8\XLA\ocr_tieng_viet\data_daxuli\train\train_051\21.jpg,Mới hay tất cả chúng tôi đã được hai ông bà người Tàu mua đi bán lại từ người khác như,True,train_051
f:\OneDrive\TAI_LIEU_HK8\XLA\ocr_tieng_viet\data_daxuli\train\train_051\22.jpg,"những món hàng. "" Cả đời tôi chẳng biết đến một dòng nhật ký. Ngày dài nơi xứ lạ",True,train_051
f:\OneDrive\TAI_LIEU_HK8\XLA\ocr_tieng_viet\data_daxuli\train\train_051\23.jpg,"với bao sự cố bất ngờ, không hi vọng, tôi thay anh em viết lại cuộc hành trình để",True,train_051
f:\OneDrive\TAI_LIEU_HK8\XLA\ocr_tieng_viet\data_daxuli\train\train_051\24.jpg,"mong ngày trở về... làm kinh nghiệm cho những lao động khác "" - Nguyễn Văn Toàn",True,train_051
f:\OneDrive\TAI_LIEU_HK8\XLA\ocr_tieng_viet\data_daxuli\train\train_051\25.jpg,"(xóm Vạn An, Vân Diên, Nam Đàn, Nghệ An) - tác giả cuốn nhật ký. Không có",True,train_051
f:\OneDrive\TAI_LIEU_HK8\XLA\ocr_tieng_viet\data_daxuli\train\train_051\26.jpg,"tiền ăn, chúng tôi phải lội suối đi vào rừng mò cua bắt cá, kiếm rau, xin đu đủ",True,train_051
f:\OneDrive\TAI_LIEU_HK8\XLA\ocr_tieng_viet\data_daxuli\train\train_051\27.jpg,... ăn cho khỏi chết đói.,True,train_051
f:\OneDrive\TAI_LIEU_HK8\XLA\ocr_tieng_viet\data_daxuli\train\train_051\28.jpg,"Làm được một tháng tám ngày, không thấy lương bổng gì, cũng không biết ai là ông",True,train_051
f:\OneDrive\TAI_LIEU_HK8\XLA\ocr_tieng_viet\data_daxuli\train\train_051\29.jpg,"chủ. Có một ông đến đưa tám lao động đi, nói vào rừng làm lán trại rồi phát cây",True,train_051
f:\OneDrive\TAI_LIEU_HK8\XLA\ocr_tieng_viet\data_daxuli\train\train_051\30.jpg,"cao su. Có tám người đi, những người không đồng ý ở lại. Tám người vào rừng",True,train_051
f:\OneDrive\TAI_LIEU_HK8\XLA\ocr_tieng_viet\data_daxuli\train\train_051\31.jpg,hôm trước thì hôm sau bị cảnh sát bắt sáu người vì không có giấy tờ tùy thân.,True,train_051
f:\OneDrive\TAI_LIEU_HK8\XLA\ocr_tieng_viet\data_daxuli\train\train_051\32.jpg,"Chu Văn Thiệp (Lâm Xuân, Nghĩa Hoàn, Tân Kỳ, Nghệ An) nằm trong số",True,train_051
f:\OneDrive\TAI_LIEU_HK8\XLA\ocr_tieng_viet\data_daxuli\train\train_051\33.jpg,"sáu người bị bắt, 19 ngày được chuộc ra khỏi tù.",True,train_051
f:\OneDrive\TAI_LIEU_HK8\XLA\ocr_tieng_viet\data_daxuli\train\train_052\1.jpg,"Với việc ra đời nghị quyết này, công tác NVƠNN thời gian tới sẽ chú trọng",True,train_052
f:\OneDrive\TAI_LIEU_HK8\XLA\ocr_tieng_viet\data_daxuli\train\train_052\2.jpg,"những điểm nào thưa ông? - Nghị quyết lần này đã nêu ra bốn nhóm giải pháp,",True,train_052
f:\OneDrive\TAI_LIEU_HK8\XLA\ocr_tieng_viet\data_daxuli\train\train_052\3.jpg,trong đó được đề cập đầu tiên là vấn đề trọng dụng nhân tài. Chúng,True,train_052
f:\OneDrive\TAI_LIEU_HK8\XLA\ocr_tieng_viet\data_daxuli\train\train_052\4.jpg,"ta biết rằng cộng đồng NVƠNN tuy vào khoảng 2,7 triệu người nhưng",True,train_052
f:\OneDrive\TAI_LIEU_HK8\XLA\ocr_tieng_viet\data_daxuli\train\train_052\5.jpg,"tiềm lực kinh tế của cộng đồng chưa phải là lớn, bù lại tiềm",True,train_052
f:\OneDrive\TAI_LIEU_HK8\XLA\ocr_tieng_viet\data_daxuli\train\train_052\6.jpg,"năng chất xám lại vô cùng phong phú. Nhiều Việt kiều trẻ tuổi, nhiều",True,train_052
f:\OneDrive\TAI_LIEU_HK8\XLA\ocr_tieng_viet\data_daxuli\train\train_052\7.jpg,trí thức kiều bào có nguyện vọng được về nước làm việc.,True,train_052
f:\OneDrive\TAI_LIEU_HK8\XLA\ocr_tieng_viet\data_daxuli\train\train_052\8.jpg,"Sắp tới, sẽ tháo gỡ toàn bộ những trở ngại, vướng mắc trong việc hợp tác làm",True,train_052
f:\OneDrive\TAI_LIEU_HK8\XLA\ocr_tieng_viet\data_daxuli\train\train_052\9.jpg,việc với trí thức kiều bào. Các cơ quan sẽ được quyền chủ động hơn,True,train_052
f:\OneDrive\TAI_LIEU_HK8\XLA\ocr_tieng_viet\data_daxuli\train\train_052\10.jpg,"trong việc mời các chuyên gia tham gia các dự án, các chương trình,",True,train_052
f:\OneDrive\TAI_LIEU_HK8\XLA\ocr_tieng_viet\data_daxuli\train\train_052\11.jpg,"không giới hạn là song phương hay đa phương. Chính sách đã có,",True,train_052
f:\OneDrive\TAI_LIEU_HK8\XLA\ocr_tieng_viet\data_daxuli\train\train_052\12.jpg,"các cơ quan chỉ việc vận dụng hợp lý, không nhất thiết việc gì",True,train_052
f:\OneDrive\TAI_LIEU_HK8\XLA\ocr_tieng_viet\data_daxuli\train\train_052\13.jpg,cũng phải báo cáo lên trên nữa. Thứ hai là sẽ tích cực,True,train_052
f:\OneDrive\TAI_LIEU_HK8\XLA\ocr_tieng_viet\data_daxuli\train\train_052\14.jpg,cải thiện môi trường pháp lý nhằm thu hút bà con Việt,True,train_052
f:\OneDrive\TAI_LIEU_HK8\XLA\ocr_tieng_viet\data_daxuli\train\train_052\15.jpg,"kiều về đầu tư, kinh doanh ở trong nước.",True,train_052
f:\OneDrive\TAI_LIEU_HK8\XLA\ocr_tieng_viet\data_daxuli\train\train_052\16.jpg,"Bên cạnh việc coi trọng NVƠNN như những nhà đầu tư, một khía cạnh",True,train_052
f:\OneDrive\TAI_LIEU_HK8\XLA\ocr_tieng_viet\data_daxuli\train\train_052\17.jpg,"vô cùng quan trọng là chính Việt kiều có thể hướng dẫn, chắp nối",True,train_052
f:\OneDrive\TAI_LIEU_HK8\XLA\ocr_tieng_viet\data_daxuli\train\train_052\18.jpg,cho nhà đầu tư nước ngoài đầu tư vào VN. Chính vì vậy nghị,True,train_052
f:\OneDrive\TAI_LIEU_HK8\XLA\ocr_tieng_viet\data_daxuli\train\train_052\19.jpg,quyết nêu rõ phải phát huy khả năng của NVƠNN trong việc,True,train_052
f:\OneDrive\TAI_LIEU_HK8\XLA\ocr_tieng_viet\data_daxuli\train\train_052\20.jpg,"làm dịch vụ, thiết lập và mở rộng kênh tiêu thụ hàng hóa VN.",True,train_052
f:\OneDrive\TAI_LIEU_HK8\XLA\ocr_tieng_viet\data_daxuli\train\train_052\21.jpg,Công tác NVƠNN sắp tới cũng sẽ chú trọng đảm bảo nhu cầu,True,train_052
f:\OneDrive\TAI_LIEU_HK8\XLA\ocr_tieng_viet\data_daxuli\train\train_052\22.jpg,"thông tin của bà con. Thời gian qua, nhiều trang báo điện",True,train_052
f:\OneDrive\TAI_LIEU_HK8\XLA\ocr_tieng_viet\data_daxuli\train\train_052\23.jpg,"tử rất mạnh được bà con Việt kiều quan tâm, trong đó có",True,train_052
f:\OneDrive\TAI_LIEU_HK8\XLA\ocr_tieng_viet\data_daxuli\train\train_052\24.jpg,Tuổi Trẻ Online.,True,train_052
f:\OneDrive\TAI_LIEU_HK8\XLA\ocr_tieng_viet\data_daxuli\train\train_052\25.jpg,Nhưng bà con vẫn có nhu cầu rất lớn về nắm các thông tin trong,True,train_052
f:\OneDrive\TAI_LIEU_HK8\XLA\ocr_tieng_viet\data_daxuli\train\train_052\26.jpg,"nước. Báo điện tử Quê Hương, tờ báo dành cho bà con kiều bào,",True,train_052
f:\OneDrive\TAI_LIEU_HK8\XLA\ocr_tieng_viet\data_daxuli\train\train_052\27.jpg,dự kiến sẽ được cải tiến toàn diện nhằm cập nhật liên tục các thông,True,train_052
f:\OneDrive\TAI_LIEU_HK8\XLA\ocr_tieng_viet\data_daxuli\train\train_052\28.jpg,"tin phục vụ bà con. Ngoài ra, chúng tôi sẽ tích cực đáp ứng nhu",True,train_052
f:\OneDrive\TAI_LIEU_HK8\XLA\ocr_tieng_viet\data_daxuli\train\train_052\29.jpg,"cầu của bà con trong việc giao lưu, học tiếng Việt, đi tham",True,train_052
f:\OneDrive\TAI_LIEU_HK8\XLA\ocr_tieng_viet\data_daxuli\train\train_052\30.jpg,"quan, tìm hiểu văn hóa truyền thống. Thủ tướng Chính phủ",True,train_052
f:\OneDrive\TAI_LIEU_HK8\XLA\ocr_tieng_viet\data_daxuli\train\train_052\31.jpg,đã phê duyệt chương trình dạy tiếng Việt cho NVƠNN.,True,train_052
f:\OneDrive\TAI_LIEU_HK8\XLA\ocr_tieng_viet\data_daxuli\train\train_052\32.jpg,Bên cạnh việc các nghệ sĩ NVƠNN được tạo điều kiện về nước biểu,True,train_052
