image_path,text,exists,group
f:\OneDrive\TAI_LIEU_HK8\XLA\ocr_tieng_viet\data_daxuli\train\train_092\8.jpg,"Trong đó có 2 quần đảo Hoàng Sa, Trường Sa và 2.577 đảo lớn, nhỏ, gần và",True,train_092
f:\OneDrive\TAI_LIEU_HK8\XLA\ocr_tieng_viet\data_daxuli\train\train_092\9.jpg,"xa bờ, hợp thành phòng tuyến bảo vệ, kiểm soát và làm chủ vùng biển.",True,train_092
f:\OneDrive\TAI_LIEU_HK8\XLA\ocr_tieng_viet\data_daxuli\train\train_092\10.jpg,"Có vị trí chiến lược quan trọng : nối liền Thái Bình Dương với Ấn Độ Dương,",True,train_092
f:\OneDrive\TAI_LIEU_HK8\XLA\ocr_tieng_viet\data_daxuli\train\train_092\11.jpg,"châu Á với châu Âu, châu Úc với Trung Đông. Giao lưu quốc tế thuận lợi,",True,train_092
f:\OneDrive\TAI_LIEU_HK8\XLA\ocr_tieng_viet\data_daxuli\train\train_092\12.jpg,phát triển ngành biển.,True,train_092
f:\OneDrive\TAI_LIEU_HK8\XLA\ocr_tieng_viet\data_daxuli\train\train_092\13.jpg,Có khí hậu biển là vùng nhiệt đới tạo điều kiện cho sinh vật biển,True,train_092
f:\OneDrive\TAI_LIEU_HK8\XLA\ocr_tieng_viet\data_daxuli\train\train_092\14.jpg,"phát triển, tồn tại tốt.",True,train_092
f:\OneDrive\TAI_LIEU_HK8\XLA\ocr_tieng_viet\data_daxuli\train\train_092\15.jpg,"Có tài nguyên sinh vật và khoáng sản phong phú, đa dạng, quý hiếm.",True,train_092
f:\OneDrive\TAI_LIEU_HK8\XLA\ocr_tieng_viet\data_daxuli\train\train_092\16.jpg,"Vùng biển và hải đảo nước ta có vị trí chiến lược hết sức to lớn, có ảnh",True,train_092
f:\OneDrive\TAI_LIEU_HK8\XLA\ocr_tieng_viet\data_daxuli\train\train_092\17.jpg,hưởng trực tiếp đến sự nghiệp bảo vệ nền độc lập dân tộc và xây dựng chủ,True,train_092
f:\OneDrive\TAI_LIEU_HK8\XLA\ocr_tieng_viet\data_daxuli\train\train_092\18.jpg,"nghĩa xã hội, có liên quan trực tiếp đến sự phồn vinh của đất nước,",True,train_092
f:\OneDrive\TAI_LIEU_HK8\XLA\ocr_tieng_viet\data_daxuli\train\train_092\19.jpg,đến văn minh và hạnh phúc của nhân dân.,True,train_092
f:\OneDrive\TAI_LIEU_HK8\XLA\ocr_tieng_viet\data_daxuli\train\train_093\1.jpg,"Vừa thấy bóng anh Nghĩa đi vào là mấy chị ở xóm ve chai ở P. 17, Gò Vấp đã đon đả thông báo : "" Bữa qua...",True,train_093
f:\OneDrive\TAI_LIEU_HK8\XLA\ocr_tieng_viet\data_daxuli\train\train_093\2.jpg,"không nhặt được gì hết. Hôm nay thì đang lựa đây "". Anh Nghĩa xắn tay áo lên cùng với mấy chị xáo",True,train_093
f:\OneDrive\TAI_LIEU_HK8\XLA\ocr_tieng_viet\data_daxuli\train\train_093\3.jpg,"tung mớ vỏ hộp, giấy vụn, sách tập cũ các loại. Trong một cuốn sách cũ chợt rơi ra tấm",True,train_093
f:\OneDrive\TAI_LIEU_HK8\XLA\ocr_tieng_viet\data_daxuli\train\train_093\4.jpg,"thẻ sinh viên của một cô gái, hết hạn năm... 2001. Mọi người cùng cười : "" Xui quá hả? Thôi,",True,train_093
f:\OneDrive\TAI_LIEU_HK8\XLA\ocr_tieng_viet\data_daxuli\train\train_093\5.jpg,"cứ cất làm kỷ niệm, biết đâu... "".",True,train_093
f:\OneDrive\TAI_LIEU_HK8\XLA\ocr_tieng_viet\data_daxuli\train\train_093\6.jpg,"Đi tìm giấy tờ rơi, những trạm trung chuyển rác và các điểm thu mua phế liệu là "" mối",True,train_093
f:\OneDrive\TAI_LIEU_HK8\XLA\ocr_tieng_viet\data_daxuli\train\train_093\7.jpg,"ruột "", những người bán hàng rong, sửa xe, thu lượm là những cộng tác viên thân",True,train_093
f:\OneDrive\TAI_LIEU_HK8\XLA\ocr_tieng_viet\data_daxuli\train\train_093\8.jpg,"thiết vì "" đi bộ, đi xe đạp, ngồi cố định một chỗ mới có nhiều cơ hội nhìn xuống đường """,True,train_093
f:\OneDrive\TAI_LIEU_HK8\XLA\ocr_tieng_viet\data_daxuli\train\train_093\9.jpg,"chứ. Từ ngày trở nên thân thiết với các nhân viên của Khai Minh, những người lao",True,train_093
f:\OneDrive\TAI_LIEU_HK8\XLA\ocr_tieng_viet\data_daxuli\train\train_093\10.jpg,động vốn rất thầm lặng bên lề đường này như vui hẳn lên.,True,train_093
f:\OneDrive\TAI_LIEU_HK8\XLA\ocr_tieng_viet\data_daxuli\train\train_093\11.jpg,""" Nếu nhặt được, chúng tôi sẽ cất giữ "", ai cũng hồ hởi hứa như vậy. Tìm và trả. Trong",True,train_093
f:\OneDrive\TAI_LIEU_HK8\XLA\ocr_tieng_viet\data_daxuli\train\train_093\12.jpg,"các ngăn kéo bàn của Nguyễn Hữu Phi, anh chàng sinh viên lơ ngơ bị mất giấy tờ dạo",True,train_093
f:\OneDrive\TAI_LIEU_HK8\XLA\ocr_tieng_viet\data_daxuli\train\train_093\13.jpg,"nào, nay là trưởng phòng báo mất Công ty Khai Minh, cất giữ hàng ngàn giấy tờ các",True,train_093
f:\OneDrive\TAI_LIEU_HK8\XLA\ocr_tieng_viet\data_daxuli\train\train_093\14.jpg,"loại đã được tìm thấy như vậy. Mỗi sáng, nhân viên của công ty lại đến bàn giao những",True,train_093
f:\OneDrive\TAI_LIEU_HK8\XLA\ocr_tieng_viet\data_daxuli\train\train_093\15.jpg,thứ họ đã tìm được ngày hôm trước và lại chia địa bàn để tiếp tục.,True,train_093
f:\OneDrive\TAI_LIEU_HK8\XLA\ocr_tieng_viet\data_daxuli\train\train_093\16.jpg,"Ở văn phòng, Phi luôn tay luôn miệng với cái máy điện thoại. Nhận thông tin báo mất,",True,train_093
f:\OneDrive\TAI_LIEU_HK8\XLA\ocr_tieng_viet\data_daxuli\train\train_093\17.jpg,"tìm kiếm địa chỉ và liên lạc với chủ nhân những giấy tờ đã tìm được, mời người đến nhận,",True,train_093
f:\OneDrive\TAI_LIEU_HK8\XLA\ocr_tieng_viet\data_daxuli\train\train_093\18.jpg,"tính phí và chi trả thù lao cho người nhặt... Hôm tôi đến, có một chị được mời đến",True,train_093
f:\OneDrive\TAI_LIEU_HK8\XLA\ocr_tieng_viet\data_daxuli\train\train_093\19.jpg,"nhận lại giấy CMND. Chị cầm tờ giấy đã bị thấm nước, hai mặt nilông bị bong,",True,train_093
f:\OneDrive\TAI_LIEU_HK8\XLA\ocr_tieng_viet\data_daxuli\train\train_093\20.jpg,"tách đôi ra ở một góc, tần ngần : "" Sao tìm được hay quá vậy?.",True,train_093
f:\OneDrive\TAI_LIEU_HK8\XLA\ocr_tieng_viet\data_daxuli\train\train_093\21.jpg,"Tôi mất hơn một tháng rồi, cũng chẳng biết mất ở đâu. Đỡ ghê, khỏi phiền phức... "".",True,train_093
f:\OneDrive\TAI_LIEU_HK8\XLA\ocr_tieng_viet\data_daxuli\train\train_093\22.jpg,Còn vô số câu chuyện thú vị như vậy. Đó là khi một anh cán bộ kêu thốt lên ngạc,True,train_093
f:\OneDrive\TAI_LIEU_HK8\XLA\ocr_tieng_viet\data_daxuli\train\train_093\23.jpg,"nhiên khi đến nhận lại một cặp hồ sơ : "" Tôi đã bị mất nó khi công tác ở Bạc Liêu",True,train_093
f:\OneDrive\TAI_LIEU_HK8\XLA\ocr_tieng_viet\data_daxuli\train\train_093\24.jpg,"cơ mà. Sao lại lưu lạc tận đây? "". Khi một chị ở An Giang lên thành phố bị giật",True,train_093
f:\OneDrive\TAI_LIEU_HK8\XLA\ocr_tieng_viet\data_daxuli\train\train_093\25.jpg,"mất giỏ xách, có điện thoại hẹn đến Q. 9 để nhận lại, chị không dám tới",True,train_093
f:\OneDrive\TAI_LIEU_HK8\XLA\ocr_tieng_viet\data_daxuli\train\train_093\26.jpg,và đã nhờ Khai Minh.,True,train_093
f:\OneDrive\TAI_LIEU_HK8\XLA\ocr_tieng_viet\data_daxuli\train\train_093\27.jpg,"Qua mấy chục cây số mênh mông là ruộng, cuối cùng cái giỏ xách đã được hoàn lại chủ.",True,train_093
f:\OneDrive\TAI_LIEU_HK8\XLA\ocr_tieng_viet\data_daxuli\train\train_093\28.jpg,Cũng có khi người được mời đến nhận giấy tờ đã đến văn phòng cùng với một anh... công,True,train_093
f:\OneDrive\TAI_LIEU_HK8\XLA\ocr_tieng_viet\data_daxuli\train\train_093\29.jpg,"an : "" Tại sao đồ tôi bị ăn trộm mà lại xuất hiện ở đây? ""... Nhưng cũng có rất nhiều",True,train_093
f:\OneDrive\TAI_LIEU_HK8\XLA\ocr_tieng_viet\data_daxuli\train\train_093\30.jpg,giấy tờ chưa tìm được chủ. Lại có nhiều giấy tờ bị những chủ nhân từ chối nhận lại.,True,train_093
f:\OneDrive\TAI_LIEU_HK8\XLA\ocr_tieng_viet\data_daxuli\train\train_094\1.jpg,Hà Nội : 98% - 100% người nghiện tái nghiện. Phát biểu tại hội nghị sơ kết ba năm công tác phòng,True,train_094
f:\OneDrive\TAI_LIEU_HK8\XLA\ocr_tieng_viet\data_daxuli\train\train_094\2.jpg,"chống ma túy, AIDS và mại dâm, tổ chức trong hai ngày 22 và 23 - 3 tại Hà Nội, Bộ trưởng Bộ Lao",True,train_094
f:\OneDrive\TAI_LIEU_HK8\XLA\ocr_tieng_viet\data_daxuli\train\train_094\3.jpg,động - thương binh & xã hội Nguyễn Thị Hằng cho biết hiện cả nước có 36.000 người mại,True,train_094
f:\OneDrive\TAI_LIEU_HK8\XLA\ocr_tieng_viet\data_daxuli\train\train_094\4.jpg,"dâm, cùng gần 3.200 đối tượng chủ chứa, gần 1.100 môi giới mại dâm và 7.000 tiếp",True,train_094
f:\OneDrive\TAI_LIEU_HK8\XLA\ocr_tieng_viet\data_daxuli\train\train_094\5.jpg,"viên trong các cơ sở kinh doanh dịch vụ, khách sạn nhà hàng có biểu hiện nghi vấn",True,train_094
f:\OneDrive\TAI_LIEU_HK8\XLA\ocr_tieng_viet\data_daxuli\train\train_094\6.jpg,hoạt động mại dâm.,True,train_094
f:\OneDrive\TAI_LIEU_HK8\XLA\ocr_tieng_viet\data_daxuli\train\train_094\7.jpg,"Gái bán dâm chủ yếu trong lứa tuổi 18 - 30, phần lớn là ít học, nghèo khó, còn lại",True,train_094
f:\OneDrive\TAI_LIEU_HK8\XLA\ocr_tieng_viet\data_daxuli\train\train_094\8.jpg,"khoảng 15% lười lao động, đua đòi ăn diện và tự nguyện đi vào con đường bán dâm.",True,train_094
f:\OneDrive\TAI_LIEU_HK8\XLA\ocr_tieng_viet\data_daxuli\train\train_094\9.jpg,""" Tệ nạn mại dâm vẫn đang diễn biến phức tạp, riêng TP.HCM có tới 10.00 gái bán dâm,",True,train_094
f:\OneDrive\TAI_LIEU_HK8\XLA\ocr_tieng_viet\data_daxuli\train\train_094\10.jpg,"đối tượng mua dâm vẫn tăng, nhiều người mua dâm là cán bộ công chức "" - bà Hằng",True,train_094
f:\OneDrive\TAI_LIEU_HK8\XLA\ocr_tieng_viet\data_daxuli\train\train_094\11.jpg,"nhấn mạnh. Về phòng chống tội phạm ma túy, trong ba năm qua số người nghiện",True,train_094
f:\OneDrive\TAI_LIEU_HK8\XLA\ocr_tieng_viet\data_daxuli\train\train_094\12.jpg,"tăng ở 53 / 64 tỉnh thành, chỉ 40% người nghiện được đưa đi cai nghiện tập",True,train_094
f:\OneDrive\TAI_LIEU_HK8\XLA\ocr_tieng_viet\data_daxuli\train\train_094\13.jpg,trung.,True,train_094
f:\OneDrive\TAI_LIEU_HK8\XLA\ocr_tieng_viet\data_daxuli\train\train_094\14.jpg,"Trong các trường học đã phát hiện 652 học sinh và 229 giáo viên nghiện ma túy. "" Đáng buồn",True,train_094
f:\OneDrive\TAI_LIEU_HK8\XLA\ocr_tieng_viet\data_daxuli\train\train_094\15.jpg,"là tỉ lệ tái nghiện còn cao ở hầu hết các địa phương, điều tra tại Hà Nội năm 2003 tỉ lệ",True,train_094
f:\OneDrive\TAI_LIEU_HK8\XLA\ocr_tieng_viet\data_daxuli\train\train_094\16.jpg,"tái nghiện sau một năm cai là 90%, sau hai năm cai là 95%, sau ba năm là... 98 -",True,train_094
f:\OneDrive\TAI_LIEU_HK8\XLA\ocr_tieng_viet\data_daxuli\train\train_094\17.jpg,"100% "" - Thứ trưởng Bộ Công an Lê Thế Tiệm cho biết. Trong khi đó số người",True,train_094
f:\OneDrive\TAI_LIEU_HK8\XLA\ocr_tieng_viet\data_daxuli\train\train_094\18.jpg,nhiễm HIV tại VN vẫn tiếp tục gia tăng. Riêng năm 2003 cả nước có trên 16.000,True,train_094
f:\OneDrive\TAI_LIEU_HK8\XLA\ocr_tieng_viet\data_daxuli\train\train_094\19.jpg,"người nhiễm HIV mới được phát hiện, nâng tổng số người nhiễm đã được phát",True,train_094
f:\OneDrive\TAI_LIEU_HK8\XLA\ocr_tieng_viet\data_daxuli\train\train_094\20.jpg,"hiện trên toàn quốc lên gần 80.000 người, phần lớn trong số này là",True,train_094
f:\OneDrive\TAI_LIEU_HK8\XLA\ocr_tieng_viet\data_daxuli\train\train_094\21.jpg,thanh niên 20 - 29 tuổi.,True,train_094
f:\OneDrive\TAI_LIEU_HK8\XLA\ocr_tieng_viet\data_daxuli\train\train_095\1.jpg,"1 - 12 - 2003, chỉ còn ít lâu là Tết Nguyên đán, công ty chuộc ra, đưa trở lại công trường,",True,train_095
f:\OneDrive\TAI_LIEU_HK8\XLA\ocr_tieng_viet\data_daxuli\train\train_095\2.jpg,"hứa giải quyết về trước tết, lại làm việc và sống cầm hơi như cũ. Ngày 2 - 1 - 2004,",True,train_095
f:\OneDrive\TAI_LIEU_HK8\XLA\ocr_tieng_viet\data_daxuli\train\train_095\3.jpg,Hồ Văn Trương bị té lầu trong khi làm việc. Từ chiều đến 11 giờ đêm mới có y tá đến,True,train_095
f:\OneDrive\TAI_LIEU_HK8\XLA\ocr_tieng_viet\data_daxuli\train\train_095\4.jpg,"đưa đi bệnh viện. 12 người trong tù ra, số còn lại thất nghiệp không có tiền ăn, phải tự",True,train_095
f:\OneDrive\TAI_LIEU_HK8\XLA\ocr_tieng_viet\data_daxuli\train\train_095\5.jpg,cứu nhau. Chủ công trường không nhận lại vì hết việc.,True,train_095
f:\OneDrive\TAI_LIEU_HK8\XLA\ocr_tieng_viet\data_daxuli\train\train_095\6.jpg,Công ty không ai dòm ngó. Hồ Văn Trương không có tiền thanh toán viện phí không biết sẽ,True,train_095
f:\OneDrive\TAI_LIEU_HK8\XLA\ocr_tieng_viet\data_daxuli\train\train_095\7.jpg,"ra sao. Có người may mắn được về hai ngày trước tết, số còn lại được đưa một ít",True,train_095
f:\OneDrive\TAI_LIEU_HK8\XLA\ocr_tieng_viet\data_daxuli\train\train_095\8.jpg,"tiền ăn và những lời hứa. Và ngày về Chiều 23 - 3 - 2004, trong khi những lao",True,train_095
f:\OneDrive\TAI_LIEU_HK8\XLA\ocr_tieng_viet\data_daxuli\train\train_095\9.jpg,"động đang chờ đợi ngoài hành lang tại chi nhánh của công ty ở TP.HCM, chúng tôi",True,train_095
f:\OneDrive\TAI_LIEU_HK8\XLA\ocr_tieng_viet\data_daxuli\train\train_095\10.jpg,làm việc trực tiếp với đại diện Công ty Bitocimex. Giám đốc là ông Nguyễn Thọ,True,train_095
f:\OneDrive\TAI_LIEU_HK8\XLA\ocr_tieng_viet\data_daxuli\train\train_095\11.jpg,"Tuấn vắng mặt đã lâu vì lý do sức khỏe, ông Lê Tuấn Anh (phó giám đốc công",True,train_095
f:\OneDrive\TAI_LIEU_HK8\XLA\ocr_tieng_viet\data_daxuli\train\train_095\12.jpg,ty) cùng người phụ trách mảng lao động trực tiếp xử lý việc này.,True,train_095
f:\OneDrive\TAI_LIEU_HK8\XLA\ocr_tieng_viet\data_daxuli\train\train_095\13.jpg,"Ông Tuấn Anh nói : "" Lỗi không của riêng ai, đây là rủi ro trong làm ăn công ty chỉ kiểm",True,train_095
f:\OneDrive\TAI_LIEU_HK8\XLA\ocr_tieng_viet\data_daxuli\train\train_095\14.jpg,"soát được một phần sự việc. Sự việc liên tục xảy ra khiến hai bên không có sự hợp tác,",True,train_095
f:\OneDrive\TAI_LIEU_HK8\XLA\ocr_tieng_viet\data_daxuli\train\train_095\15.jpg,"tin cậy..., mệt mỏi từ hai phía "". Không tiền bạc, sức khỏe vơi đi cùng cả số tư",True,train_095
f:\OneDrive\TAI_LIEU_HK8\XLA\ocr_tieng_viet\data_daxuli\train\train_095\16.jpg,trang ít ỏi trên người cũng được đánh đổi lấy đồ dùng trong những ngày ở tù. Họ đếm,True,train_095
f:\OneDrive\TAI_LIEU_HK8\XLA\ocr_tieng_viet\data_daxuli\train\train_095\17.jpg,"từng ngày trôi đi trong gánh nặng tiền bạc. Riêng Hồ Văn Thông, số hộ chiếu",True,train_095
f:\OneDrive\TAI_LIEU_HK8\XLA\ocr_tieng_viet\data_daxuli\train\train_095\18.jpg,"AX 0134520, ở Cương Gián, Nghi Xuân, Hà Tĩnh, ngày 21 - 3 - 2004 đã về",True,train_095
f:\OneDrive\TAI_LIEU_HK8\XLA\ocr_tieng_viet\data_daxuli\train\train_095\19.jpg,"đến TP.HCM sau cuộc hành trình ba ngày từ Malaysia qua Thái Lan, Campuchia",True,train_095
f:\OneDrive\TAI_LIEU_HK8\XLA\ocr_tieng_viet\data_daxuli\train\train_095\20.jpg,và đến cửa khẩu An Giang.,True,train_095
f:\OneDrive\TAI_LIEU_HK8\XLA\ocr_tieng_viet\data_daxuli\train\train_095\21.jpg,""" Tôi không dám tin rằng mình còn sống bởi tất cả như là cơn ác mộng, hết đi từ nỗi",True,train_095
f:\OneDrive\TAI_LIEU_HK8\XLA\ocr_tieng_viet\data_daxuli\train\train_095\22.jpg,sợ hãi này đến kinh hoàng khác. Cứ lấy chân đạp trên nền đất để biết rất thật rằng,True,train_095
f:\OneDrive\TAI_LIEU_HK8\XLA\ocr_tieng_viet\data_daxuli\train\train_095\23.jpg,"đây là VN "". Vì không nằm trong danh sách những người được công ty đưa về, khủng",True,train_095
f:\OneDrive\TAI_LIEU_HK8\XLA\ocr_tieng_viet\data_daxuli\train\train_095\24.jpg,"hoảng và kiệt sức, tôi cố bám theo đoàn thương lái 30 người, trà trộn và giả dạng",True,train_095
f:\OneDrive\TAI_LIEU_HK8\XLA\ocr_tieng_viet\data_daxuli\train\train_095\25.jpg,"người Campuchia, nhảy xe khách, đi bộ hàng chục kilômet, qua hàng rào cảnh sát",True,train_095
f:\OneDrive\TAI_LIEU_HK8\XLA\ocr_tieng_viet\data_daxuli\train\train_095\26.jpg,"các nước, may nhờ một người VN che chở đã đóng tiền để qua được các vòng.",True,train_095
f:\OneDrive\TAI_LIEU_HK8\XLA\ocr_tieng_viet\data_daxuli\train\train_095\27.jpg,"Đôi mắt thâm quầng và nước da xanh mét, Thông nói : "" Dẫu sao chúng tôi cũng",True,train_095
f:\OneDrive\TAI_LIEU_HK8\XLA\ocr_tieng_viet\data_daxuli\train\train_095\28.jpg,"may mắn hơn những bạn bè khác hiện đang còn kẹt lại ở xứ người "".",True,train_095
f:\OneDrive\TAI_LIEU_HK8\XLA\ocr_tieng_viet\data_daxuli\train\train_096\1.jpg,Chiếc xe cấp cứu của chúng tôi băng băng với tốc độ chóng mặt.,True,train_096
f:\OneDrive\TAI_LIEU_HK8\XLA\ocr_tieng_viet\data_daxuli\train\train_096\2.jpg,"Đang giờ tan tầm, trên đường xe qua lại như đan mắt lưới.",True,train_096
f:\OneDrive\TAI_LIEU_HK8\XLA\ocr_tieng_viet\data_daxuli\train\train_096\3.jpg,Tiếng còi hụ liên hồi. Anh Nghĩa lái xe bất ngờ thắng gấp vì từ,True,train_096
f:\OneDrive\TAI_LIEU_HK8\XLA\ocr_tieng_viet\data_daxuli\train\train_096\4.jpg,"ngã ba một chiếc Spacy phóng ngang qua. Trên đường đi,",True,train_096
f:\OneDrive\TAI_LIEU_HK8\XLA\ocr_tieng_viet\data_daxuli\train\train_096\5.jpg,thỉnh thoảng xe phải dừng lại vì những bác xích lô chở sắt,True,train_096
f:\OneDrive\TAI_LIEU_HK8\XLA\ocr_tieng_viet\data_daxuli\train\train_096\6.jpg,thép cứ nhơi nhơi cuống thép dài ngoằng chực quất vào kẻ,True,train_096
f:\OneDrive\TAI_LIEU_HK8\XLA\ocr_tieng_viet\data_daxuli\train\train_096\7.jpg,khác. Ngoài ra những chiếc xe ben ngược chiều phóng bạt,True,train_096
f:\OneDrive\TAI_LIEU_HK8\XLA\ocr_tieng_viet\data_daxuli\train\train_096\8.jpg,mạng như muốn lao vào xe cấp cứu.,True,train_096
f:\OneDrive\TAI_LIEU_HK8\XLA\ocr_tieng_viet\data_daxuli\train\train_096\9.jpg,Một thanh niên mặc đồ dân phòng chờ sẵn nơi đầu hẻm,True,train_096
f:\OneDrive\TAI_LIEU_HK8\XLA\ocr_tieng_viet\data_daxuli\train\train_096\10.jpg,"đón chúng tôi. Xe dừng, các anh chị em CCV mỗi người một",True,train_096
f:\OneDrive\TAI_LIEU_HK8\XLA\ocr_tieng_viet\data_daxuli\train\train_096\11.jpg,"việc. BS Hà chuẩn bị y cụ, ĐDV Kim Chi xách theo vali cấp",True,train_096
f:\OneDrive\TAI_LIEU_HK8\XLA\ocr_tieng_viet\data_daxuli\train\train_096\12.jpg,"cứu, ĐDV Huệ đem chiếc băng ca đẩy vào nhà có nạn nhân.",True,train_096
f:\OneDrive\TAI_LIEU_HK8\XLA\ocr_tieng_viet\data_daxuli\train\train_096\13.jpg,"Người bệnh là một bà cụ lớn tuổi, bị bí tiểu bụng căng lên",True,train_096
f:\OneDrive\TAI_LIEU_HK8\XLA\ocr_tieng_viet\data_daxuli\train\train_096\14.jpg,như cái trống hầu. BS Hà vừa chẩn đoán bệnh vừa an ủi,True,train_096
f:\OneDrive\TAI_LIEU_HK8\XLA\ocr_tieng_viet\data_daxuli\train\train_096\15.jpg,và động viên tinh thần. ĐDV Kim Chi tiêm một mũi thuốc,True,train_096
f:\OneDrive\TAI_LIEU_HK8\XLA\ocr_tieng_viet\data_daxuli\train\train_096\16.jpg,thông tiểu.,True,train_096
f:\OneDrive\TAI_LIEU_HK8\XLA\ocr_tieng_viet\data_daxuli\train\train_096\17.jpg,"Thấy ổn, cùng với người nhà, CCV chuyển bệnh nhân ra băng",True,train_096
f:\OneDrive\TAI_LIEU_HK8\XLA\ocr_tieng_viet\data_daxuli\train\train_096\18.jpg,"ca, đưa lên xe. Còi cứu thương lại bắt đầu hú lên. Chiếc xe",True,train_096
f:\OneDrive\TAI_LIEU_HK8\XLA\ocr_tieng_viet\data_daxuli\train\train_096\19.jpg,lại phải len lỏi qua những ngả đường để chuẩn bị đưa về,True,train_096
f:\OneDrive\TAI_LIEU_HK8\XLA\ocr_tieng_viet\data_daxuli\train\train_096\20.jpg,"Bệnh viện Chợ Rẫy, quận 5. Cụ già rên hừ hừ. ĐDV Huê",True,train_096
f:\OneDrive\TAI_LIEU_HK8\XLA\ocr_tieng_viet\data_daxuli\train\train_096\21.jpg,an ủi và lấy y cụ bó thật chặt vòng bụng để bà cụ,True,train_096
f:\OneDrive\TAI_LIEU_HK8\XLA\ocr_tieng_viet\data_daxuli\train\train_096\22.jpg,"không bị đau khi xe xóc. Được chừng mươi phút đường xe,",True,train_096
f:\OneDrive\TAI_LIEU_HK8\XLA\ocr_tieng_viet\data_daxuli\train\train_096\23.jpg,bà cụ đòi ói mửa. Anh Huệ lấy bao nilông cho cụ nhưng,True,train_096
f:\OneDrive\TAI_LIEU_HK8\XLA\ocr_tieng_viet\data_daxuli\train\train_096\24.jpg,"không kịp nữa, cụ đã ói tràn ra sàn xe.",True,train_096
f:\OneDrive\TAI_LIEU_HK8\XLA\ocr_tieng_viet\data_daxuli\train\train_096\25.jpg,Mùi ói xông nồng nặc.,True,train_096
f:\OneDrive\TAI_LIEU_HK8\XLA\ocr_tieng_viet\data_daxuli\train\train_097\1.jpg,BẢN CHẤT CỦA THÀNH CÔNG,True,train_097
f:\OneDrive\TAI_LIEU_HK8\XLA\ocr_tieng_viet\data_daxuli\train\train_097\2.jpg,Đã bao giờ bạn tự hỏi thành công là gì mà bao kẻ bỏ cả cuộc đời mình theo đuổi? Phải chăng,True,train_097
f:\OneDrive\TAI_LIEU_HK8\XLA\ocr_tieng_viet\data_daxuli\train\train_097\3.jpg,"đó là kết quả hoàn hảo trong công việc, sự chính xác đến từng chi tiết? Hay đó là cách nói",True,train_097
f:\OneDrive\TAI_LIEU_HK8\XLA\ocr_tieng_viet\data_daxuli\train\train_097\4.jpg,"khác của từ thành đạt, nghĩa là có được một cuộc sống giàu sang, được mọi người nể phục?",True,train_097
f:\OneDrive\TAI_LIEU_HK8\XLA\ocr_tieng_viet\data_daxuli\train\train_097\5.jpg,Vậy thì bạn hãy dành chút thời gian để lặng mình suy ngẫm.,True,train_097
f:\OneDrive\TAI_LIEU_HK8\XLA\ocr_tieng_viet\data_daxuli\train\train_097\6.jpg,Cuộc sống sẽ chỉ cho bạn có những người đạt được thành công theo một cách giản dị đến bất,True,train_097
f:\OneDrive\TAI_LIEU_HK8\XLA\ocr_tieng_viet\data_daxuli\train\train_097\7.jpg,ngờ.,True,train_097
f:\OneDrive\TAI_LIEU_HK8\XLA\ocr_tieng_viet\data_daxuli\train\train_097\8.jpg,"Thành công là khi bố và con trai có dũng khí bước vào bếp, nấu những món ăn mẹ thích nhân",True,train_097
f:\OneDrive\TAI_LIEU_HK8\XLA\ocr_tieng_viet\data_daxuli\train\train_097\9.jpg,"ngày 8 - 3. Món canh có thể hơi mặn, món cá sốt đáng lẽ phải có màu đỏ sậm thì lại ngả sang",True,train_097
f:\OneDrive\TAI_LIEU_HK8\XLA\ocr_tieng_viet\data_daxuli\train\train_097\10.jpg,"màu... đen cháy. Nhưng nhìn mâm cơm, mẹ vẫn cười. Bởi vì hai bố con không thể thành",True,train_097
f:\OneDrive\TAI_LIEU_HK8\XLA\ocr_tieng_viet\data_daxuli\train\train_097\11.jpg,"công trên "" chiến trường "" bếp núc, nhưng lại thành công khi tặng mẹ "" đoá hồng "" của tình yêu.",True,train_097
f:\OneDrive\TAI_LIEU_HK8\XLA\ocr_tieng_viet\data_daxuli\train\train_097\12.jpg,"Một món quà ý nghĩa hơn cả những món quà quý giá, hạnh phúc ấy long lanh in trong mắt",True,train_097
f:\OneDrive\TAI_LIEU_HK8\XLA\ocr_tieng_viet\data_daxuli\train\train_097\13.jpg,mẹ.,True,train_097
f:\OneDrive\TAI_LIEU_HK8\XLA\ocr_tieng_viet\data_daxuli\train\train_097\14.jpg,"Thành công còn là hình ảnh một cậu bé bị dị tật ở chân, không bao giờ đi lại bình thường",True,train_097
f:\OneDrive\TAI_LIEU_HK8\XLA\ocr_tieng_viet\data_daxuli\train\train_097\15.jpg,"được. Từ nhỏ cậu đã nuôi ước mơ trở thành cầu thủ bóng đá. Sau bao nỗ lực khổ luyện, cậu",True,train_097
f:\OneDrive\TAI_LIEU_HK8\XLA\ocr_tieng_viet\data_daxuli\train\train_097\16.jpg,"bé trở thành cầu thủ dự bị trong một đội bóng nhỏ, và chưa bao giờ được chính thức ra sân.",True,train_097
f:\OneDrive\TAI_LIEU_HK8\XLA\ocr_tieng_viet\data_daxuli\train\train_097\17.jpg,"Nhưng đó không phải là thất bại. Trái lại, thành công đã nở hoa khi cậu bé năm xưa, với bao",True,train_097
f:\OneDrive\TAI_LIEU_HK8\XLA\ocr_tieng_viet\data_daxuli\train\train_097\18.jpg,"nghị lực và quyết tâm, đã chiến thắng hoàn cảnh để theo đuổi ước mơ từ ngày thơ bé.",True,train_097
f:\OneDrive\TAI_LIEU_HK8\XLA\ocr_tieng_viet\data_daxuli\train\train_097\19.jpg,"Thành công ấy, liệu có mấy người đạt được?",True,train_097
f:\OneDrive\TAI_LIEU_HK8\XLA\ocr_tieng_viet\data_daxuli\train\train_097\20.jpg,"Sau mỗi mùa thi đại học, có bao "" sĩ tử "" buồn rầu khi biết mình trở thành "" tử sĩ "". Hai bảy điểm,",True,train_097
f:\OneDrive\TAI_LIEU_HK8\XLA\ocr_tieng_viet\data_daxuli\train\train_097\21.jpg,cao thật đấy. Nhưng cao mà làm gì khi NV1 lấy tới hai bảy phẩy năm? Đó thật ra không phải,True,train_097
